description,title,section,site,issue_num,link
"Android Studio 2.2 Preview 3 was recently released. This preview comes with the highly requested feature revealed at Google I/O this year, Espresso Test Recorder.",Writing Android Tests with Espresso Test Recorder,Articles & Tutorials,peirr.com,209,http://peirr.com/writing-android-tests-with-espresso-test-recorder/
In this post by the genius engineering team you'll learn techniques how put your APK on a diet.,"A smaller, sleeker app using the APK Analyzer",Articles & Tutorials,genius.engineering,209,http://genius.engineering/blog/2016/6/9/a-smaller-sleeker-apk-using-the-package-analyzer
"The industry leading mobile PDF library helps you achieve seamless viewing, annotating and fast indexed searching of PDFs. Let us take care of your PDF needs so you can focus on what makes your app great. The library can be customized to any use case and integrated in minutes. Come see why were trusted by Atlassian, Box, IBM and others.",PSPDFKit - PDF SDK Trusted by Companies You Know,Sponsored,pspdfkit.com,209,https://pspdfkit.com/
Bored at work? Want to try a new stack? Find 3500+ great tech companies on Hired who will compete to hire you. Try it today.,Hired is the best place to find engineering jobs,Sponsored,hired.com,209,https://hired.com/?utm_source=newsletter&utm_medium=androidweekly&utm_term=cat-tech-android&utm_campaign=q2-16&utm_location=us&utm_content=bestplace
"While there is no magic bullet for creating a perfect first-time experience, one thing is for sure — the first impression is all about your users. Make your users feel like the center of attention by removing all roadblocks to usage. Invite them to stay. ",Mobile App UX Design: Making a Great First Impression,Design,uxplanet.org,209,https://uxplanet.org/mobile-app-ux-design-making-a-great-first-impression-bed2805b967d#.neb3krt2s
We're looking for developers with extensive knowledge of Android. The perfect candidate would be highly skilled in different frameworks and libraries. We are 100% remote and we provide the funding needed to help you achieve your goals and grow as a remote developer.,Android Developer at X-Team,Jobs,Remote,209,http://goo.gl/u045WE
Custom view for user input that models horizontal wheel controller.,HorizontalWheelView,Libraries & Code,github.com,209,https://github.com/shchurov/HorizontalWheelView
Android library which makes detecting gestures a breeze. The library is built for simplicity and ease of use. It eliminates most boilerplate code for dealing with setting up gesture detection on Android.,Sensey,Libraries & Code,github.com,209,https://github.com/nisrulz/sensey
"Android library to get device information in a super easy way.The library is built for simplicity and approachability. It not only eliminates most boilerplate code for dealing with device information, but also provides an easy and simple API to retrieve them.",Easydeviceinfo,Libraries & Code,github.com,209,https://github.com/nisrulz/easydeviceinfo
"A simple, open-source Mondo client for Android with unit and functional tests.",Mondroid,Libraries & Code,github.com,209,https://github.com/hitherejoe/Mondroid
"Google is introducing a new Android feature called Nearby, which notifies you of of things that can be helpful near you.",Introducing Nearby: A new way to discover the things around you,News,android.googleblog.com,209,https://android.googleblog.com/2016/06/introducing-nearby-new-way-to-discover.html
Android Studio 2.2 Preview 3 is available. Google fixed a lot of bugs concerning the new UI. One of the biggest new features: Convert Photoshop files directly to Vector Drawable. We would love to see Sketch support as well.,Android Studio 2.2 Preview 3,News,tools.android.com,209,http://tools.android.com/recent/androidstudio22preview3available
rxlint is currently a single lint rule that detects a subscription without a handler for onError(),Rxlint: an Android lint rule for RxJava code,Tools,www.littlerobots.nl,209,http://www.littlerobots.nl/blog/RxLint-a-lint-rule-for-RxJava/
Hannes Dorfmann's presentation on Android app architecture.,Android Software Architecture by Example,Videos & Podcasts,www.youtube.com,209,https://www.youtube.com/watch?v=7t7MN8e1W7s
Effie Barak tells us how Udemy switches from MediaPlayer to ExoPlayer. You can hear more about it at her talk at 360andev.com,Android Dialogs: Effie Barak,Videos & Podcasts,www.youtube.com,209,https://www.youtube.com/watch?v=4V6Btjquxrc&feature=youtu.be
"Many of you have requested this feature, and so we did it! We've implemented a simple full text search so that you can search for a keyword.",Android Weekly Archive Search,Specials,androidweekly.net,209,http://androidweekly.net/search
At Apps World 2016 you’ll get access to the big picture views from leading developers and industry pioneers as well as hands on coding workshops. Talks will focus on creating the best UX/UI possible and workshops will cover next stage testing to take your app to the next level.,"Apps World 2016, London ExCel 19-20 October",Events,world.apps-world.net,209,https://world.apps-world.net/developers/
The Novoda team shares some tips to make your APK smaller to improve the end-users' install experience.,Leaner APKs with asset minification ,Articles & Tutorials,www.novoda.com,208,https://www.novoda.com/blog/leaner-apks-with-custom-asset-minification/
"There are ways that memory can be leaked logically within Java. Ultimately, this means that your Android apps are still susceptible to wasting unnecessary memory and crashing as a result of out-of-memory (OOM) errors.",Eight Ways Your Android App Can Leak Memory ,Articles & Tutorials,blog.nimbledroid.com,208,http://blog.nimbledroid.com/2016/05/23/memory-leaks.html
"Daniel Molinero Reguera introduces Dart & Henson, a library that generates a navigation layer and make it easy, convenient, fast and robust to navigate among your activities and services.",Better Android Intents with Dart & Henson ,Articles & Tutorials,medium.com,208,https://medium.com/groupon-eng/better-android-intents-with-dart-henson-1ca91793944b#.7c55qxt5g
"Although still in alpha phase with some issues, Tamás Agócs shows how ConstraintLayout is a really useful tool. It can speed up the UI development and can also produce more efficient layouts.",ConstraintLayout on Android - How Ready Is It?,Articles & Tutorials,leaks.wanari.com,208,http://leaks.wanari.com/2016/05/31/constraintlayout-android/
Team Android at Basecamp recently passed a fairly big milestone — over 25% of the Basecamp 3 Android app code base now runs on Kotlin! Here they share a couple things they like about it.,Some of my favorite Kotlin features,Articles & Tutorials,m.signalvnoise.com,208,https://m.signalvnoise.com/some-of-my-favorite-kotlin-features-that-we-use-a-lot-in-basecamp-5ac9d6cea95#.1j516x7j9
"In this article, Roberto Orgiu explores another way to retain a running Observable.",Crunching RxAndroid — Part 9,Articles & Tutorials,medium.com,208,https://medium.com/crunching-rxandroid/crunching-rxandroid-part-9-37cfc28e2249#.usr05oeiz
"Drag-and-drop has been part of Android since 3.0 for single windows, but now, with multi-window support, drag-and-drop can work between apps… and that is where you need to be careful.",Be Careful of Drag-and-Drop on Android N,Articles & Tutorials,commonsware.com,208,https://commonsware.com/blog/2016/06/01/be-careful-drag-drop-android-n.html
"A lot of Android apps nowadays use RxJava as a foundation of the control flow for business logic. What if you go further and apply it everywhere, including View layer?",RxUi: Talking to Android View layer in a Reactive way,Articles & Tutorials,artemzin.com,208,http://artemzin.com/blog/rxui-talking-to-android-view-layer-in-a-reactive-way/
If you are an Android developer you probably have come to a point when you wanted to change font’s for items in you layouts. András Németh shares a great technique along with a GitHub sample.,Yet another way for applying fonts ,Articles & Tutorials,medium.com,208,https://medium.com/@HackDdroid/yet-another-way-for-applying-fonts-and-more-350d45accf10#.u7snoefga
"Android developers, it's time to boost your productivity! Greenhouse is a cloud-based continuous integration service that builds, tests and distributes your apps for every commit without any complicated configuration or setup. We help you build higher quality apps that are delivered to end-users faster.",Hassle-free Continuous Integration for Mobile Apps,Sponsored,greenhouseci.com,208,http://greenhouseci.com/?utm_source=androidweekly
"Hired lets you sit back while job offers come to you. When you complete your profile, instantly apply to 3,500+ companies on the platform who will contact you with job offers, including salary and equity up-front. Try it today.",The Easiest Way to Find a Job,Sponsored,hired.com,208,https://hired.com/?utm_source=newsletter&utm_medium=androidweekly&utm_term=cat-tech-android&utm_campaign=q2-16&utm_location=us&utm_content=easiest
"Enhance your app / service with a photo editor. It's fully customizable and SDKs are available for Android, iOS and HTML5. ",Photo Editor SDK,Sponsored,photoeditorsdk.com,208,http://photoeditorsdk.com
"‘Errors’ happens. They happen in our apps and they happen in our life. Whatever the cause, these errors — and how they are handled — can have a huge impact on the way user experiences your app.",User Errors,Design,uxplanet.org,208,https://uxplanet.org/mobile-ux-design-user-errors-1ad1f5d664f9#.3djawg55c
The first interaction with the app plays a key role in creating overall impression (either good or bad). And when users open a new app the last thing they want to see is multiple popups in a row asking for permissions.,The Right Ways to Ask Users for Permissions,Design,uxplanet.org,208,https://uxplanet.org/mobile-ux-design-the-right-ways-to-ask-users-for-permissions-6cdd9ab25c27#.wudy6ccbk
"We are developing the next generation of marketing automation with real-time technology. Distributed and fault tolerant, our system is processes vast amounts of data. As the Android Developer you have ownership over the 360dialog SDK and build new features that add value for mobile app developers. ",Senior Android Developer,Jobs,Berlin,208,http://www.360dialog.com/jobs/
"Kudoz is looking for a Senior Android Developer to build the V2 of its job hunting mobile app. Greenfield project (no legacy code) in a fun and young startup. Contract based in Paris, France, with initial contract duration of 2 months min. starting ASAP. Competitive rate.",Senior Android Freelance @ Paris (no remote),Jobs,"Paris, France",208,http://developers.getkudoz.com/join_us/#senior-android-developer-freelance-paris-france
"We at PSPDFKit care about great software. Our framework ships in many of the top-ranked apps on Google Play. Do you know your way around Android development, Java, Kotlin and are not afraid of JNI and Modern C++? Come join us in pushing the boundaries of what Android devices can do!",Senior Android Engineer - Help us build an SDK,Jobs,Remote,208,https://pspdfkit.com/jobs/#section_android
"A showcase of RxJava and Model View Presenter, plus a number of other popular libraries for android development, including AutoValue, Retrofit, Moshi, and ButterKnife. Unit tests covering any business logic and Robolectric tests verifying the ui.",Rxjava-mvp-giphy,Libraries & Code,github.com,208,https://github.com/emmaguy/rxjava-mvp-giphy
An extension for Google's AutoValue that omits @Redacted field values from toString().,Auto-value-redacted,Libraries & Code,github.com,208,https://github.com/square/auto-value-redacted
Dynamic blur of underlying Views for Android. Includes library and small example project.,BlurView,Libraries & Code,github.com,208,https://github.com/Dimezis/BlurView
Android library for boilerplate destruction that generates boilerplate code based on annotations and lets you focus on what matters. Generated code is fully traceable. Everything is generated during compile time. No reflection used! Broken down into small modules.,Blade,Libraries & Code,github.com,208,https://github.com/FrantisekGazo/Blade
Tool for create complex morphing animations using VectorDrawables (allows morphing between any pair of SVG image),Vectalign,Tools,github.com,208,https://github.com/bonnyfone/vectalign#vectalign----
In Part 2 of the Google IO special we continue asking some simple questions to the best AndroidDev today. ,Google IO 2016 (Part 2),Videos & Podcasts,fragmentedpodcast.com,208,http://fragmentedpodcast.com/episodes/43/
"Chris Lacy and Koushik Dutta break down all the big announcements such as Home, Allo, Duo and Daydream. We also discussed Google's advancements in AI, the Android Wear 2.0 release, Android Instant Apps and more.",Google I/O 2016 keynote,Videos & Podcasts,theblerg.net,208,http://theblerg.net/podcast/25
Learn how to use onData() to look for data in the Adapters backing your AdapterViews to easily bring the required row on screen.,Android Testing Patterns #3: AdapterViews and Espresso,Videos & Podcasts,www.youtube.com,208,https://www.youtube.com/watch?v=zi7v47kYKrk&feature=youtu.be
Rebecca Franks takes you step by step through using the new ConstraintLayout.,ConstraintLayout 101 & the new Layout Builder,Articles & Tutorials,riggaroo.co.za,207,http://riggaroo.co.za/constraintlayout-101-new-layout-builder-android-studio/
Another look at the new ConstraintLayout control from Google.,Exploring the new Android ConstraintLayout ,Articles & Tutorials,medium.com,207,https://medium.com/exploring-android/exploring-the-new-android-constraintlayout-eed37fe8d8f1#.vugvoerb3
"Ryan Harter goes a bit more in depth to look at what extensions are, how they work, and how they can help you get even more out of AutoValue.",AutoValue Extensions,Articles & Tutorials,ryanharter.com,207,http://ryanharter.com/blog/2016/05/16/autovalue-extensions/
"Taking screenshots for the play store is boring as hell: several locales, three form factors, setting up content data for the screenshots. Juliane Lehmann decided to automate and shows us how.",Automating play store screenshots for fun and testing,Articles & Tutorials,lambdasoup.com,207,https://lambdasoup.com/post/automate_screenshots_1/
"Mark Allison continues to look at flexbox-layout, an Android layout manager which offers similar behavior to the CSS flexible box layout module.",FlexboxLayout – Part 3,Articles & Tutorials,blog.stylingandroid.com,207,https://blog.stylingandroid.com/flexboxlayout-part-3/
This Google CodeLab takes you through using the new ConstraintLayout.,Using ConstraintLayout to design your views,Articles & Tutorials,codelabs.developers.google.com,207,https://codelabs.developers.google.com/codelabs/constraint-layout/index.html
Marc Reichelt shares how he sets up Jenkins to track method counts and APK size over time.,Android APK size + dexcount charts on Jenkins,Articles & Tutorials,medium.com,207,https://medium.com/@mreichelt/android-apk-size-dexcount-charts-on-jenkins-ae518e961818#.nynv6zenr
"Trusted by Atlassian, Box, IBM and more - the industry leading mobile PDF library helps you achieve seamless viewing, annotation editing and fast indexed search of PDFs. The library can be customized and easily integrated no matter the use case. Used by thousands of companies and touched by millions of people everyday.",PSPDFKit - The Industry Leading Mobile PDF Library,Sponsored,pspdfkit.com,207,https://pspdfkit.com/
"Buddybuild is a mobile continuous integration and deployment platform that takes minutes to set-up. Our SDK makes it super easy to get feedback and crash reports from users in real-time. Stop cobbling together and maintaining disparate build, deployment, crash reporting and feedback systems. Focus on what you do best: creating apps people love!",Buddybuild: continuous integration & delivery made easy! ,Sponsored,buddybuild.com,207,https://buddybuild.com/?ref=androidweekly0508
"On Hired, Android engineers typically get 5+ job offers in 1 week. Find that new opportunity you've been craving and get access to 3,500+ companies instantly.",Work on a Better Stack!,Sponsored,hired.com,207,https://hired.com/?utm_source=newsletter&utm_medium=androidweekly&utm_term=cat-tech-android&utm_campaign=q2-16&utm_location=us&utm_content=betterstack
Progressive disclosure is a strategy for managing information complexity.,Design Patterns: Progressive Disclosure for Mobile Apps,Design,uxplanet.org,207,https://uxplanet.org/design-patterns-progressive-disclosure-for-mobile-apps-f41001a293ba#.qse41gtye
"Centralway’s vision is to create the world’s leading mobile banking platform. Therefore, we are looking for highly skilled Android Engineers, who are interested in changing the future of mobile banking with us. ","Software Engineer, Android",Jobs,"Zürich, Switzerland",207,https://www.centralway.com/en/careers/open-positions/details#oOgFZfws
"We at PSPDFKit care about great software. Our framework ships in many of the top-ranked apps on Google Play. Do you know your way around Android development, Java, Kotlin and are not afraid of JNI and Modern C++? Come join us in pushing the boundaries of what Android devices can do!",Senior Android Engineer - Help us build an SDK,Jobs,Remote,207,https://pspdfkit.com/jobs/#section_android
Yelp connects consumers with great local businesses all across the world. We’re looking for Android developers of all levels who love creating delightful user experiences for millions of people and thrive in taking ownership of the product they work on.,Android Engineer,Jobs,"San Francisco, CA",207,https://jobs.lever.co/yelp/46136fee-03e6-4766-b6ad-a8b87c0bf9cd?lever-source=Android_Weekly_Newsletter
"Toothpick is a scope tree based Dependency Injection (DI) library for Java. It is a full-featured, runtime based, but reflection free, implementation of JSR 330.",Toothpick,Libraries & Code,github.com,207,https://github.com/stephanenicolas/toothpick
"A fluent Mockito Builder class.",Mocker,Libraries & Code,github.com,207,https://github.com/yongjhih/mocker
The Raspberry Pi 3 appears to be on track to receive official AOSP support from Google. ,Google Is Preparing To Add The RasPi 3 To AOSP,News,www.androidpolice.com,207,http://www.androidpolice.com/2016/05/24/google-is-preparing-to-add-the-raspberry-pi-3-to-aosp-it-will-apparently-become-an-officially-supported-device/
Wojtek Kalicinski introduces the two main types of tests that you will write for your app.,Android Testing Patterns #1 ,Videos & Podcasts,www.youtube.com,207,https://www.youtube.com/watch?v=W8LJjfkTKik&feature=youtu.be
Learn the basic structure of an Espresso test and how to run and execute instrumentation tests in Android Studio.,Android Testing Patterns #2: UI testing with Espresso ,Videos & Podcasts,www.youtube.com,207,https://www.youtube.com/watch?v=kL3MCQV2M2s&feature=youtu.be
"In this mini Fragment, Donn talks about one of his favorite topics, YAGNI. YAGNI is an acronym that stands for “You Aren’t Gonna Need It”. ",YAGNI,Videos & Podcasts,fragmentedpodcast.com,207,http://fragmentedpodcast.com/episodes/41/
Here's a presentation from Droidcon SF on using Google Cloud Test Lab to improve the quality of Android apps.,Using Google Cloud Test Lab,Videos & Podcasts,www.youtube.com,207,https://www.youtube.com/watch?v=vSdKZqJ73a8&feature=youtu.be
"In this episode, Chet and Tor talk with Romain Guy about some of the new features in the Android N preview release.",Android Developers Backstage 49: What's New in N,Videos & Podcasts,androidbackstage.blogspot.com,207,http://androidbackstage.blogspot.com/2016/05/episode-49-whats-new-in-n.html
"Rebecca Franks tells us about Book Dash, a volunteer effort to create African storybooks that anyone can freely translate and distribute. She showed us her Book Dash Android app, and how she plans to migrate it from Parse to Firebase.",Android Dialogs: Rebecca Franks,Videos & Podcasts,www.youtube.com,207,https://www.youtube.com/watch?v=XwU1pEIYv-U&feature=youtu.be
"#AnDevCon, August 1-4 Boston, is the world's top Android apps event. 35+ exhibitors. Use code ANDROID for $200 discount","#AnDevCon, August 1-4 Boston",Specials,www.andevcon.com,207,http://www.andevcon.com
"#WearablesTechCon, July 18-20 San Jose, is the top wearables apps and HW event. Use code WEARIT for $100 discount","#WearablesTechCon, July 18-20 San Jose",Specials,www.wearablestechcon.com,207,http://www.wearablestechcon.com
Google has produced Material wear design guidelines for the upcoming Wear 2.0.,Material Design for Wearables,Articles & Tutorials,www.google.com,206,http://www.google.com/design/spec-wear/material-design-for-wearables/introduction.html
In this article Mark Allison looks at the layout attributes which can be applied to child Views to control how they are positioned within the parent FlexboxLayout.,FlexboxLayout – Part 2,Articles & Tutorials,blog.stylingandroid.com,206,https://blog.stylingandroid.com/flexboxlayout-part2/
"Android Wear 2.0 updates the visual style and interaction paradigm of notifications as well as introduces expanded notifications, which provide substantial additional content and actions in an app-like experience.",Notification Changes in Android Wear 2.0,Articles & Tutorials,developer.android.com,206,https://developer.android.com/wear/preview/features/notifications.html
"With just a few lines of code, you can enable quick and seamless checkout to help increase purchase conversions and ongoing engagement.",Enhancing Android Pay APIs,Articles & Tutorials,android-developers.blogspot.com,206,http://android-developers.blogspot.com/2016/05/enhancing-android-pay-apis.html
"The Awareness API unifies 7 location and context signals in a single API, enabling you to create powerful context-based features with minimal impact on system resources. ",Google Awareness API,Articles & Tutorials,developers.google.com,206,https://developers.google.com/awareness/
"Gabriele Mariotti takes a quick look at how easy it is to integrate Firebase crash reporting, and what the reports look like.",The new Firebase Crash Reporting,Articles & Tutorials,medium.com,206,https://medium.com/@gabri.mariotti/the-new-firebase-crash-reporting-fa411c6cf05b#.kywtgyl94
Bored at work? Want to try a new stack? Find 3500+ great tech companies on Hired who will compete to hire you. Try it today.,Hired is the best place to find engineering jobs ,Sponsored,hired.com,206,https://hired.com/?utm_source=newsletter&utm_medium=androidweekly&utm_term=cat-tech-android&utm_campaign=q2-16&utm_location=us&utm_content=bestplace
Yelp connects consumers with great local businesses all across the world. We’re looking for Android developers of all levels who love creating delightful user experiences for millions of people and thrive in taking ownership of the product they work on.,Android Engineer,Jobs,"San Francisco, CA",206,https://jobs.lever.co/yelp/46136fee-03e6-4766-b6ad-a8b87c0bf9cd?lever-source=Android_Weekly_Newsletter
You're looking for Android developers for your company or project? Reach more than 41000 with a Job Posting in Android Weekly. ,Reach more than 41k Android Developers,Jobs,androidweekly.net,206,http://androidweekly.net/jobs/new
A sweeter Espresso. Never write your own IdlingResource again. Never manually turn off system animations again.,Cappuccino,Libraries & Code,github.com,206,https://github.com/metova/Cappuccino
"RxSocialConnect simplifies the process of retrieving authorizations tokens from multiple social networks to a minimalist observable call, from any Fragment or Activity.",RxSocialConnect-Android,Libraries & Code,github.com,206,https://github.com/FuckBoilerplate/RxSocialConnect-Android
Google Developer Certification is a program designed so you can show what you can do and not simply what you know. It allows you to demonstrate your proficiency and skill with typical tasks that you as a developer perform daily in your job.,Google Developer Training,News,developers.google.com,206,https://developers.google.com/training/certification/
Google launched a fully revamped Sign-In API with Google Play services 8.3 providing a much more streamlined user experience and enabling easy server authentication and authorization. ,Improving the Security and UX of your Google Sign In Implementation,News,android-developers.blogspot.com,206,http://android-developers.blogspot.com/2016/05/improving-security-and-user-experience.html
"Google has improved the Play console with better betas, the pre-launch report, benchmarks, a new Play Console app, and more.",What’s new in Google Play,News,android-developers.blogspot.com,206,http://android-developers.blogspot.com/2016/05/whats-new-in-google-play-at-io-2016.html
"Google announced Android Instant Apps, and it evolves Android apps to be able to run instantly, without requiring installation. With Instant Apps, a tap on a URL can open right in an Android app, even if the user doesn’t have that app installed.",Introducing Android Instant Apps,News,android-developers.blogspot.com,206,http://android-developers.blogspot.com/2016/05/android-instant-apps-evolving-apps.html
Google announced the most significant Android Wear update since its launch two years ago: Android Wear 2.0. It will be available to users this fall. ,Android Wear 2.0 Developer Preview,News,android-developers.blogspot.com,206,http://android-developers.blogspot.com/2016/05/android-wear-20-developer-preview.html
"The N-Release, Virtual Reality, Android Studio 2.2 and more",What’s new in Android,News,android-developers.blogspot.com,206,http://android-developers.blogspot.com/2016/05/whats-new-in-android-n-release-virtual-reality-android-studio.html
