description,title,section,site,issue_num,link
"How Iván Carballo and his team wrote 250 UI tests that run under 3 minutes with Espresso, Mockito and Dagger.",Fast and reliable UI tests on Android,Articles & Tutorials,labs.ribot.co.uk,212,https://labs.ribot.co.uk/fast-and-reliable-ui-tests-on-android-17c261b8220c#.ny3uhsivr
The Philosophical Hacker ponders what a unit test recorder would look and work like.,Why don't we have a unit test recorder?,Articles & Tutorials,www.philosophicalhacker.com,212,http://www.philosophicalhacker.com/post/why-dont-we-have-a-unit-test-recorder/
"Download the app to stay up to date with features and best practices that will help you grow a successful app or game business on Google Play. Get tailored content based on your objectives, and the latest articles and videos from Google experts and across the web.",Get the Playbook app for developers,Sponsored,play.google.com,212,https://play.google.com/store/apps/details?id=com.google.android.apps.secrets&utm_source=newsletter&utm_medium=email&utm_content=ad2&utm_campaign=androidweekly
"On Hired, Android engineers typically get 5+ job offers in 1 week. Find that new opportunity you've been craving and get access to 3,500+ companies instantly.",Work on a Better Stack!,Sponsored,hired.com,212,https://hired.com/?utm_source=newsletter&utm_medium=androidweekly&utm_term=cat-tech-android&utm_campaign=q2-16&utm_location=us&utm_content=betterstack
"Motion in the world of design is used to describe spatial relationships, functionality, and intention with beauty and fluidity. Thoughtful motion in design can enhance the user’s experience over traditional design elements.",Motion in UX Design,Design,uxplanet.org,212,https://uxplanet.org/motion-in-ux-design-90f6da5c32fe#.fh32i7g60
"Centralway’s vision is to change the future of mobile banking.  Therefore, we are looking for skilled and motivated Android Engineers with a passion for high quality products, experience in publishing apps in the Google Play store and a strong knowledge of Android UI design principles. ",Android Engineer,Jobs,"Zürich, Switzerland",212,https://www.centralway.com/en/careers/open-positions/details#oOgFZfws
"We’re looking for experienced Android engineers to come and help us reinvent email and calendar on mobile for millions of people. Based in SF or NY, you'd be part of the Outlook for Android team, building the best user experience out there alongside our server and design teams.",Android Engineer at Microsoft,Jobs,"United States, San Francisco CA / New York NY",212,https://aka.ms/d9nqhi
SQLCipher 3.5.0 with support for Android N was released recently.,SQLCipher 3.5.0 for Android Release,Libraries & Code,discuss.zetetic.net,212,https://discuss.zetetic.net/t/sqlcipher-for-android-release-android-n-support/1465
A simple bash script to enable demo mode on a Marshmallow+ device via ADB.,Enable demo mode on a Marshmallow+ device via ADB,Libraries & Code,gist.github.com,212,https://gist.github.com/rock3r/369ef6fa734c865c564ef4fe5fb6ef6b
A new Blueprints sample has been released! An approach to MVP using CursorLoaders and ContentProvider.,android-architecture,Libraries & Code,github.com,212,https://github.com/googlesamples/android-architecture/tree/todo-mvp-contentproviders
"Boris Farber, author of the great ClassyShark APK inspection tool, has started to create a user guide for it. Check it out and please provide comments and content.",ClassyShark User guide,Libraries & Code,github.com,212,https://github.com/borisf/classyshark-user-guide
"Google has release the new Google Cast SDK. This new SDK focuses on making development for Cast quicker, more reliable, and easier to maintain. ",New Google Cast SDK released for Android and iOS,News,developers.googleblog.com,212,https://developers.googleblog.com/2016/06/new-google-cast-sdk-released-for.html
"Google Awareness API is available to all developers through Google Play services. It enables your apps to intelligently react to user context using snapshots and fences with minimal impact on system resources.","Create Intelligent, Context-Aware Apps with the Google Awareness APIs",News,android-developers.blogspot.com,212,http://android-developers.blogspot.com/2016/06/create-intelligent-context-aware-apps.html
"The latest version of the Google Maps Android API includes the ability to order the display of markers on the map with the new marker zIndex property, the ability to set the transparency of your tile overlays, and a new circle click listener.",Marker zIndex and more come to the Google Maps Android API,News,googlegeodevelopers.blogspot.com,212,http://googlegeodevelopers.blogspot.com/2016/06/marker-zindex-and-more-come-to-google.html
"This session examines the importance of lean layouts, tools for analyzing layouts and their performance, tips and techniques for making layouts leaner, common mistakes and misconceptions, and general good practices.",Loving Lean Layouts,Videos & Podcasts,www.youtube.com,212,https://www.youtube.com/watch?v=gwqQT5NrhUg
"The aim of this talk is to showcase the importance of a well thought out software architecture and how to implement such an MVP based architecture and last but not least to clarify what the word “reactive” actually means in this context.",Refactoring Plaid App – A reactive MVP approach,Videos & Podcasts,www.youtube.com,212,https://www.youtube.com/watch?v=wWyPc_HN77c&feature=youtu.be
Hosts Artem Zinnatullin and Hannes Dorfmann discuss Android TV with Joe Birch,TheContext 5 with Joe Birch,Videos & Podcasts,github.com,212,https://github.com/artem-zinnatullin/TheContext-Podcast/blob/master/show_notes/Episode_5.md
This discussion is about whether creating an interface for the Presenter in MVP is really needed.,Interfaces for presenters in MVP are a waste of time!,Articles & Tutorials,blog.karumi.com,211,http://blog.karumi.com/interfaces-for-presenters-in-mvp-are-a-waste-of-time/
"As documented in the Android N behavioral changes, to protect Android users and apps from unforeseen crashes, Android N will restrict which libraries your C/C++ code can link against at runtime.",Improving Stability Private C/C++ Symbol Restrictions in Android N,Articles & Tutorials,android-developers.blogspot.com,211,http://android-developers.blogspot.com/2016/06/improving-stability-with-private-cc.html
"As we all know a good programmer is the one who can propose good separation of concerns, so the code is readable and understandable by anyone.",Presentation Model and Passive View in MVP,Articles & Tutorials,medium.com,211,https://medium.com/@andrzejchm/presentation-model-and-passive-view-in-mvp-the-android-way-fdba56a35b1e#.1ohcmw8o6
One of the features of developing an Android application with Android Studio is data binding. The most basic thing you get is elimination of findViewById!,No More findViewById,Articles & Tutorials,medium.com,211,https://medium.com/google-developers/no-more-findviewbyid-457457644885#.t9mh59nv7
Zarah Dominguez gets fancy with git history.,Snazzy git blaming,Articles & Tutorials,www.zdominguez.com,211,http://www.zdominguez.com/2016/06/snazzy-git-blaming.html
"The Philosophical Hacker introduces Vice, a recent library that helps to reduce the burden of writing regression tests.",Vice: A Regression Test Generation Library,Articles & Tutorials,www.philosophicalhacker.com,211,http://www.philosophicalhacker.com/post/vice-a-regression-test-generation-library/
"In the last article Mark Allison looked at how to create constraints to position a widget relative to another or the parent ConstraintLayout, but he can also fine tune the size and positioning by using a few layout parameters on the child widgets",ConstraintLayout – Part 4,Articles & Tutorials,blog.stylingandroid.com,211,https://blog.stylingandroid.com/constraintlayout-part-4/
How to avoid manual initialization methods in your Android library. Automatically initialise your library with the app's context on start up.,Auto-Initialize your Android Library,Articles & Tutorials,medium.com,211,https://medium.com/@andretietz/auto-initialize-your-android-library-2349daf06920#.symblhigu
Stay up to date with features and best practices that will help you grow a successful app or game business on Google Play.,Get the Playbook app for developers,Sponsored,play.google.com,211,https://play.google.com/store/apps/details?id=com.google.android.apps.secrets&utm_source=newsletter&utm_medium=email&utm_content=ad1&utm_campaign=androidweekly
"Trusted by Atlassian, Box, IBM and more - the industry leading mobile PDF library helps you achieve seamless viewing, annotation editing and fast indexed search of PDFs. The library can be customized and easily integrated no matter the use case. Used by thousands of companies and touched by millions of people everyday.",PSPDFKit - The Industry Leading Mobile PDF Library,Sponsored,pspdfkit.com,211,https://pspdfkit.com/
Bored at work? Want to try a new stack? Find 3500+ great tech companies on Hired who will compete to hire you. Try it today.,Hired is the best place to find engineering jobs,Sponsored,hired.com,211,https://hired.com/?utm_source=newsletter&utm_medium=androidweekly&utm_term=cat-tech-android&utm_campaign=q2-16&utm_location=us&utm_content=bestplace
The thing that people really want is helpful information and they appreciate layouts which provide enough information for them to make a fully informed buying decision.,Mobile App UX Design: Grid View For Products,Design,uxplanet.org,211,https://uxplanet.org/mobile-app-ux-design-grid-view-for-products-947e94c1fcb8#.amrvqbh58
A concept for what it would be like ordering fast-food on Android TV…,Android TV & Chill,Design,medium.com,211,https://medium.com/@hitherejoe/android-tv-chill-3ba9c413daef#.3wztaei2b
"OutBank is Germany’s largest independent banking app, that simplifies your finances by consolidating all accounts and transactions in one secure and smart app. We are searching for a skilled and talented Android Developer (m/f). Become part of a dynamic, international team.",Android Developer,Jobs,Munich / Dachau / Germany,211,http://www.outbank.de/it/developers/2015/10/26/android-developer-mf
"We’re looking for experienced Android engineers to come and help us reinvent email and calendar on mobile for millions of people. Based in SF or NY, you'd be part of the Outlook for Android team, building the best user experience out there alongside our server and design teams.",Android Engineer at Microsoft,Jobs,"United States, San Francisco CA / New York NY",211,https://aka.ms/d9nqhi
Quill is the beautiful Android app for your Ghost blog.,Quill,Libraries & Code,github.com,211,https://github.com/vickychijwani/quill
Custom espresso actions for operating on descendant views such as children of a RecyclerView,EspressoDescendantActions,Libraries & Code,github.com,211,https://github.com/joerogers/EspressoDescendantActions
"Small Android library to help you incorporate MVP, Passive View and Presentation Model patterns in your app.",DroidMVP,Libraries & Code,github.com,211,https://github.com/andrzejchm/DroidMVP
Preview 4 resolves the largest amount of bugs in the 2.2 release to date and includes some minor new features. ,Android Studio 2.2 Preview 4 Available,News,sites.google.com,211,https://sites.google.com/a/android.com/tools/recent/androidstudio22preview4available?pli=1
This is the DSL reference for Android Gradle Plugin.,Android Plugin 2.1.0 DSL Reference,Tools,google.github.io,211,http://google.github.io/android-gradle-dsl/current/index.html
"Multi-window opens up a lot of new possibilities, but designing for split-screen multi-window starts with a responsive UI. With a few special considerations, you’ll have a great looking app.",Designing for Split-Screen Multi-Window,Videos & Podcasts,www.youtube.com,211,https://www.youtube.com/watch?v=hi5R0gq9tdA
"In this episode, Chet and Tor talk with Jorim Jaggi, Selim Cinek and Adrian Roos from the System UI team about all the ""math-gic"" behind the animations in Lollipop, Marshmallow and N.",Swisstem UI,Videos & Podcasts,androidbackstage.blogspot.com,211,http://androidbackstage.blogspot.com/2016/06/episode-51-swisstem-ui.html
"Huyen chats with Liam Spradlin (Google Design Expert, podcaster, livestreamer, and mutator) about the 5217 app and mutative design.",5217 and Mutative Design,Videos & Podcasts,www.youtube.com,211,https://www.youtube.com/watch?v=hhmhLTdg-6k&feature=youtu.be
"While at Droidcon Italy, Huyen picks Benjamin Augustin's brain on functional programming.",Functional Programming,Videos & Podcasts,www.youtube.com,211,https://www.youtube.com/watch?v=Gng13R8ooAA&feature=youtu.be
"Spock maintainer Rob Fletcher demonstrates the current state of Kotlin testing frameworks by comparing it to Spek, JetBrains’s twist on a specification framework.",Testing With Kotlin #2,Videos & Podcasts,realm.io,211,https://realm.io/news/kau-rob-fletcher-kotlin-testing/
Spek framework contributor Laura Kogler demonstrates the current state of Kotlin testing frameworks and discusses expected further advancements in testing support.,Testing With Kotlin #1,Videos & Podcasts,realm.io,211,https://realm.io/news/kau-laura-kogler-kotlin-testing/
"An introduction to custom Views and ViewGroups, subclassing the View class, and performing completely custom drawing within that subclass.",Custom Views and ViewGroups,Videos & Podcasts,caster.io,211,https://caster.io/episodes/custom-views-and-viewgroups-part-1/
"MobileOptimized 2016 will be held on July 15-16 in Belarus! Early Bird tickets are already available! Main focus will be on Android and iOS development: applications architecture, test automation, Swift, Realm, Kotlin and more.",MobileOptimized 2016 ,Events,mo.dev.by,211,http://mo.dev.by/english
,Take a look at our conferences list,Events,androidweekly.net,211,http://androidweekly.net/conferences
Several useful pro tips for using Android Studio.,How To Use Android Studio Like a Pro! ,Articles & Tutorials,stanfy.com,210,https://stanfy.com/blog/use-android-studio-like-a-pro/
"Reactive Programming is interesting (again) and there is a lot of noise about it at the moment, not all of which is very easy to understand for an outsider and simple Java developer. This article (the first in a series) might help to clarify your understanding of what the fuss is about.",Notes on Reactive Programming Part I: The Reactive Landscape ,Articles & Tutorials,spring.io,210,https://spring.io/blog/2016/06/07/notes-on-reactive-programming-part-i-the-reactive-landscape
"This article continues the series on Reactive Programming, and concentrates on explaining some concepts through actual code samples.",Notes on Reactive Programming Part II: Writing Some Code ,Articles & Tutorials,spring.io,210,https://spring.io/blog/2016/06/13/notes-on-reactive-programming-part-ii-writing-some-code
"An immutable class is just a simple class whose instances cannot be modified. Alexandru Simonescu shows why you would use them, and a couple different libraries that make it easier.",Clean Java immutability ,Articles & Tutorials,blog.alexsimo.com,210,http://blog.alexsimo.com/clean-java-immutability/
This post is a part of series of posts showing Dependency Injection with Dagger 2 framework in Android. This one takes a look at Multibinding and Autofactory and implements ViewHolder pattern with Dagger 2.,Inject everything — ViewHolder and Dagger 2,Articles & Tutorials,medium.com,210,https://medium.com/@froger_mcs/inject-everything-viewholder-and-dagger-2-e1551a76a908#.itgywmvbk
Now that you’ve learned the basic concepts of ConstraintLayout let’s turn attention to the visual editor to see how we can create constraints.,ConstraintLayout – Part 3,Articles & Tutorials,blog.stylingandroid.com,210,https://blog.stylingandroid.com/constraintlayout-part-3/
Slides from Jeroen Mols' talk at Droidcon Berlin 2016 ,Testing made sweet with a Mockito,Articles & Tutorials,speakerdeck.com,210,https://speakerdeck.com/jeroenmols/testing-made-sweet-with-a-mockito
 Mark Murphy takes a closer look at the changes in N Developer Preview 4,Random Musings on the N Developer Preview 4,Articles & Tutorials,commonsware.com,210,https://commonsware.com/blog/2016/06/16/random-musings-n-developer-preview-4.html
Jeroen Mols recaps his experience at Droidcon Berlin.,Droidcon Berlin recap,Articles & Tutorials,jeroenmols.com,210,http://jeroenmols.com/blog/2016/06/18/droidconde/
Philippe Breault shows how to implement the missing Application onStart() and onStop().,"No, You Can Not Override the Home Button... But You Don't Have To!",Articles & Tutorials,www.developerphil.com,210,http://www.developerphil.com/no-you-can-not-override-the-home-button-but-you-dont-have-to/
Mikhail Nakhimovich explores another type of performance optimization: APK size. A smaller APK results in faster resource lookup and faster reflection.,App Diets are not a Fad,Articles & Tutorials,blog.nimbledroid.com,210,http://blog.nimbledroid.com/2016/06/15/app-diets-not-a-fad.html
"Multicasting is a key method for reducing duplicated work in RxJava. When you multicast an event, you send the same event to all downstream operators/subscribers.",Multicasting in RxJava,Articles & Tutorials,blog.danlew.net,210,http://blog.danlew.net/2016/06/13/multicasting-in-rxjava/
"Hired lets you sit back while job offers come to you. When you complete your profile, instantly apply to 3,500+ companies on the platform who will contact you with job offers, including salary and equity up-front. Try it today.",The Easiest Way to Find a Job,Sponsored,hired.com,210,https://hired.com/?utm_source=newsletter&utm_medium=androidweekly&utm_term=cat-tech-android&utm_campaign=q2-16&utm_location=us&utm_content=easiest
You want to advertise your product which helps Android developers doing their job? Place a sponsored post in Android Weekly and reach more than 42000 Android developers around the world.,Place a sponsored post in Android Weekly,Sponsored,androidweekly.net,210,http://androidweekly.net/jobs/new
There is no section in mobile app that is more critical for conversion than the product screen. This article discusses product screens and highlights a few important elements of each product screen .,Mobile UX Design: Product Screen,Design,uxplanet.org,210,https://uxplanet.org/mobile-ux-design-product-screen-5fec660f2e84#.xfq1boyku
"We're looking for a strong mid-senior level Android engineer to join our small team of 6. We believe in continuously improving our skills and codebase, work/life balance, and doing things right over doing them fast. We’re looking for engineers who share this view and are excited about writing qualit",Android Developer,Jobs,"San Francisco, CA",210,https://boards.greenhouse.io/scribd/jobs/74217#.V2SA1uYrIUE
"Join Southeast Asia’s largest mobile tech company and start making an impact today! We are planning to significantly grow the Mobile Engineering team, and looking for multiple skilled Android developers to bring our unique on-demand transport experience to millions of people, anytime and anywhere.","Mobile Engineer, Android",Jobs,"Grab R&D in Singapore, Seattle or Beijing",210,https://jobs.lever.co/grab/21eef24d-cf21-4af8-817f-3ab26f6d7488
"The FlixBus Android team supports both our popular consumer and internal apps. We're a small team, and everyone plays a critical part in efining and building the perfect experience for our FlixBus customers. Come work on a mobile app that has revolutionized the transportation industry in Europe. ",Android Engineer (f/m),Jobs,Berlin,210,https://jobs.flixmobility.com/job/job-android-engineer-f-m-_10.aspx
"We’re looking for experienced Android engineers to come and help us reinvent email and calendar on mobile for millions of people. Based in SF or NY, you'd be part of the Outlook for Android team, building the best user experience out there alongside our server and design teams.",Android Engineer at Microsoft,Jobs,"United States, San Francisco CA / New York NY",210,https://aka.ms/d9nqhi
RxGroups lets you group RxJava Observables together in groups and tie them to your Android lifecycle. This is especially useful when used with Retrofit,RxGroups,Libraries & Code,github.com,210,https://github.com/airbnb/RxGroups
"Google has released the 4th Developer Preview of Android N, including the Android N final SDK. Now it's time to get your Apps in shape for Android N.",Android N APIs are now final,News,android-developers.blogspot.de,210,http://android-developers.blogspot.de/2016/06/android-n-apis-are-now-final.html
"In this show the Fragmented crew talks with embedded technology expert and all round super smart AndroidDev Dave Smith a.k.a the wonderful devunwired.",Bluetooth (LE) with Dave Smith,Videos & Podcasts,fragmentedpodcast.com,210,http://fragmentedpodcast.com/episodes/45/
Eugenio Marletti's & Sebastiano Poggi's presentation on fragments from MCE^3 conference.,Life Without Fragments,Videos & Podcasts,www.youtube.com,210,https://www.youtube.com/watch?v=jl1HRiCaAP4
"You've missed the Droidcon Berlin 2016? No problem! Just click your way through all the talks, featuring ""Say Kotlin one more time"", ""Screenshot your entire App"", ""Unittesting without Robolectric"", ""Toothpick and Dependency injection"" and many, many more!",Talks from Droidcon Berlin 2016,Videos & Podcasts,voicerepublic.com,210,https://voicerepublic.com/users/droidcon-berlin
"In this lesson you will learn how to enable offline cache in Retrofit (via OkHttp) so that your application can work in a disconnected environment.",Retrofit 2 - Enabling Offline Cache,Videos & Podcasts,caster.io,210,https://caster.io/episodes/retrofit-2-offline-cache/
"Apply now to spend a week at the European Space Agency (ESA) and show us the best apps you've developed so far. To get selected for the Space App Camp, your previous work will need to shine in terms of the creativity of its content, usability, design, and underlying business concepts. This could be your big chance!","Space App Camp, Italy",Specials,www.app-camp.eu,210,http://www.app-camp.eu/
"#WearablesTechCon, July 18-20 San Jose, is the top wearables apps and HW event. Use code WEARIT for $100 discount","#WearablesTechCon, July 18-20 San Jose",Events,www.wearablestechcon.com,210,http://www.wearablestechcon.com/
"#AnDevCon, August 1-4 Boston, is the world's top Android apps event. 35+ exhibitors. Use code ANDROID for $200 discount","#AnDevCon, August 1-4 Boston",Events,www.andevcon.com,210,http://www.andevcon.com
Joe Birch takes a deep dive into ‘Buy with Android Pay’ to discover exactly what we could do with it.,Exploring Buy with Android Pay ,Articles & Tutorials,labs.ribot.co.uk,209,https://labs.ribot.co.uk/exploring-buy-with-android-pay-4c8822c86133#.u1virfa0d
Saúl Molinero shares some tips and tricks for using IntelliJ and Android Studio.,The powerful Android Studio  ,Articles & Tutorials,saulmm.github.io,209,http://saulmm.github.io/the-powerful-android-studio
You probably know that Google's Material Design spec specifies to make your Navigation Drawer span the full height of the screen. Yet many apps fail to do this when their navigation drawer is opened.,Make that drawer visible under your status bar ,Articles & Tutorials,matthewwear.xyz,209,http://matthewwear.xyz/no-excuses-it-takes-5-mins-make-that-drawer-visible-under-your-status-bar-2/
"To provide a better user experience, notifications on Android N have received a visual refresh, improved support for custom views, and expanded functionality in the forms of Direct Reply, a new MessagingStyle, and bundled notifications.",Notifications in Android N ,Articles & Tutorials,android-developers.blogspot.com,209,http://android-developers.blogspot.com/2016/06/notifications-in-android-n.html
Jeroen Mols shows how you can visualize your current method count and understand what libraries are eating up the largest part of that. Next it's time to reduce said method count and remove that nasty multidex solution once and for all.,Efficiently reducing your method count,Articles & Tutorials,jeroenmols.com,209,http://jeroenmols.com/blog/2016/05/06/methodcount/
At Google IO 2016 Google announced a new Android layout named ConstraintLayout.  In this series of articles Mark Allison takes a look at this new layout-kid on the block and try and get some insights in how best to use it.,ConstraintLayout – Part 1 ,Articles & Tutorials,blog.stylingandroid.com,209,https://blog.stylingandroid.com/constraintlayout-part-1/
"Mark continues his look at ConstraintLayout, and justifies the reason for yet another layout container.",ConstraintLayout – Part 2 ,Articles & Tutorials,blog.stylingandroid.com,209,https://blog.stylingandroid.com/constraintlayout-part-2/
"While the author was looking at Google's code lab on testing, he stumbled upon something disturbing within. You won't believe what happens next.",PSA: Dont Use Espresso Idling Resources like Google does,Articles & Tutorials,www.philosophicalhacker.com,209,http://www.philosophicalhacker.com/post/psa-dont-use-esprsso-idling-resources-like-this/
"In this post, Rebecca Franks looks at creating a set of file templates that can achieve similar results to the default ones in Android Studio.",How to create a group of File Templates in Android Studio - Part 3,Articles & Tutorials,riggaroo.co.za,209,https://riggaroo.co.za/custom-file-template-group-android-studiointellij/
"If your Android app derives keys using the SHA1PRNG algorithm from the Crypto provider, you must start using a real key derivation function and possibly re-encrypt your data.","Security ""Crypto"" provider deprecated in Android N",Articles & Tutorials,android-developers.blogspot.com,209,http://android-developers.blogspot.com/2016/06/security-crypto-provider-deprecated-in.html
