description,title,section,site,issue_num,link
This post is focused on examining the ConstraintLayout container architecture and how it does its job. ,"ConstraintLayout, Inside and Out: Part 1",Articles & Tutorials,wiresareobsolete.com,215,http://wiresareobsolete.com/2016/07/constraintlayout-part-1/
Here are some important tips to consider when creating an open source library.,How not to become a public enemy - Part 1 ,Articles & Tutorials,blog.karumi.com,215,http://blog.karumi.com/how-not-to-become-a-public-enemy-part-1/
In this post Savelii Zagurskii showcases a solution for the situation where a developer has an external library which is very slow to load and initialize.,How to Load Heavy Libraries on Splash Screen,Articles & Tutorials,szagurskii.com,215,http://szagurskii.com/blog/how-to-load-heavy-libraries-on-splash-screen/
"Whether you’re building an app for a remote viewfinder, to set up a connected light bulb, or to control a quadcopter, if it’s Wi-Fi based you will need to connect to a hotspot that may not have Internet connectivity.",Connecting your App to a Wi-Fi Device ,Articles & Tutorials,android-developers.blogspot.com,215,http://android-developers.blogspot.com/2016/07/connecting-your-app-to-wi-fi-device.html
The team at Robinhood open sourced their gorgeous ticker text control.,"Hello, Ticker ",Articles & Tutorials,medium.com,215,https://medium.com/robinhood-engineering/hello-ticker-20eaf6e51689#.d7nw27cle
"This post covers Doze Mode in more detail, the changes that are coming with Android Nougat and what you can do to correctly adapt to Doze Mode.",Diving into Doze Mode for Developers,Articles & Tutorials,www.bignerdranch.com,215,https://www.bignerdranch.com/blog/diving-into-doze-mode-for-developers/
MVVM + RxJava is a great formula for an app architecture making it scalable and maintainable. Here are a few lessons learned along the way.,MVVM + RxJava: Common Mistakes,Articles & Tutorials,upday.github.io,215,https://upday.github.io/blog/mvvm_rx_common_mistakes/
"Roberto Orgiu examins the new Awareness API, which combines 7 different feeds managing both the battery drain and the used memory.",Is your app Aware?,Articles & Tutorials,medium.com,215,https://medium.com/@_tiwiz/is-your-app-aware-6c831098310#.prq8v80oz
In this blog post Hannes Dorfmann gives you a brief history of the Repository Pattern and discusses why it could lead to over abstraction and over engineering.,The evolution of the repository pattern,Articles & Tutorials,hannesdorfmann.com,215,http://hannesdorfmann.com/android/evolution-of-the-repository-pattern
"With these three tips, we can obtain a greater ROI from our crash reporting implementation and gain more insights into the application.",Getting the most out of Crashlytics,Articles & Tutorials,medium.com,215,https://medium.com/fuzz/getting-the-most-out-of-crashlytics-380afb703876#.m8h2fvtfd
There's a trick to create() an observable that supports backpressure in a proper way. It turns out that there’s a helper class called SyncOnSubscribe that does this. But how do you use it? ,RxJava SyncOnSubscribe,Articles & Tutorials,www.littlerobots.nl,215,http://www.littlerobots.nl/blog/Note-to-self-RxJava-SyncOnSubscribe/
Dan Lew often sees confusion around Android View constructors. In this article he tries to answer all your questions.,A deep dive into Android View constructors,Articles & Tutorials,blog.danlew.net,215,http://blog.danlew.net/2016/07/19/a-deep-dive-into-android-view-constructors/
There are several articles that show how to start working with DI. Here Mirek Stanek shares his more advanced experiences with Dagger 2 after almost two years of having this in a production app.,Dagger 2 on production — reducing methods count,Articles & Tutorials,medium.com,215,https://medium.com/azimolabs/dagger-2-on-production-reducing-methods-count-5a13ff671e30#.gqtzeiza7
Here’s another way of explaining reactive programming: this time with Donald Duck and his nephews.,Building a Reactive Mindset,Articles & Tutorials,upday.github.io,215,https://upday.github.io/blog/reactive_mindset_burgers/
"Should we actually be using ConstraintLayout in “real” projects yet? The short answer is “No”, but firmness of that “No” is diminishing with each release.",ConstraintLayout – Part 8,Articles & Tutorials,blog.stylingandroid.com,215,https://blog.stylingandroid.com/constraintlayout-part-8/
David Karnok documents the meaning of backpressure in Reactive extensions.,Backpressure,Articles & Tutorials,stackoverflow.com,215,http://stackoverflow.com/documentation/rx-java/2341/backpressure#t=201607222027088359387
"On Hired, Android engineers typically get 5+ job offers in 1 week. Find that new opportunity you've been craving and get access to 3,500+ companies instantly.",Work on a Better Stack! ,Sponsored,hired.com,215,https://hired.com/?utm_source=newsletter&utm_medium=androidweekly&utm_term=cat-tech-android&utm_campaign=q2-16&utm_location=us&utm_content=betterstack
"Join our Mobile Software Engineering Team (Rheinfabrik) in Düsseldorf, Germany.",Software Engineer – Android,Jobs,Düsseldorf,215,http://bit.ly/2allfuC
"Mobile mercenaries, are you up for the challenge? We’re calling on you to follow your passion and find innovative ways to build a solid mobile experience and open up the world for all the world’s most daring adventurers.Enroll for online competition, get selected and come to Amsterdam!",Passions Hacked - Booking.com's open hackathon,Jobs,Amsterdam,215,https://workingatbooking.com/passions-hacked/
"We have fully embraced RXJava, using it for all async operations. We investigate and utilize new third party libraries, including but not limited to Butterknife/OkHTTP/Retrofit/Guava (not new but grrreat!) /Picasso/ Roboelectric/ Mockito, etc. etc.We were out with the release of Wear & Google Fit.",Principal Android Developer,Jobs,"Boston, MA",215,https://boards.greenhouse.io/runkeeper/jobs/200526
An Android text view with scrolling text change animation,Ticker,Libraries & Code,github.com,215,https://github.com/robinhood/ticker
Simple and powerful MVP library for Android,Ferro,Libraries & Code,github.com,215,https://github.com/MaksTuev/ferro
"Google Play is investing in improvements to reduce the data that needs to be transferred for app installs and updates, while making data cost more transparent to users.",Improvements for smaller app downloads on Google Play,News,android-developers.blogspot.com,215,http://android-developers.blogspot.com/2016/07/improvements-for-smaller-app-downloads.html
"Google has released Developer Preview 5, the last milestone of this preview series.",Final Developer Preview before Android 7.0 Nougat,News,android-developers.blogspot.com,215,http://android-developers.blogspot.com/2016/07/final-developer-preview.html
"Build great individual notifications, group them together, then create a summary notification - used on older Android versions and to build the bundle’s header on API 24 devices.",Bundled Notifications,Videos & Podcasts,www.youtube.com,215,https://www.youtube.com/watch?v=2ZQ1D003g14&feature=youtu.be
In this show Kaushik talks to Dan about translating an app for other languages.,Translating an app for different languages with Dan Lew,Videos & Podcasts,fragmentedpodcast.com,215,http://fragmentedpodcast.com/episodes/049/
"Rebecca Franks takes a look at how you can improve your users experience by reducing their mobile data usage. Three areas for improvement are covered, areas such as Server Interactions, Images and your Bundled APK size.",Reducing Mobile Data Usage in your Android Apps,Videos & Podcasts,www.youtube.com,215,https://www.youtube.com/watch?v=tnj2uoTwevg&feature=youtu.be
"There are thousands of ways to enrich mobile apps with big data from space - what's yours? Enter the challenge and seize the opportunity to meet with like-minded people, create mobile applications using satellite data und gain insight into ESA's work.",Apply Now For the Space App Camp,Events,www.app-camp.eu,215,http://www.app-camp.eu/
"Reto Meier shows how the Awareness API helps you engage users in specific situations using simple, battery efficient ways to check their current context, and to create “fences” so your app can react to a specific set of conditions.",Using the Awareness API for Android,Articles & Tutorials,medium.com,214,https://medium.com/google-developers/using-the-awareness-api-for-android-a185b05e7254#.tebafpllc
Dan Kim wrote a guide on how to go about writing and releasing an open source library for Android.,How I built your first Android open source library,Articles & Tutorials,m.signalvnoise.com,214,https://m.signalvnoise.com/how-i-built-my-first-android-open-source-library-and-how-you-can-too-8a731abbdd2a#.edy2ik5ej
This tutorial shows how to create a ripple effect in any color.,Programmatically create a RippleDrawable of any color,Articles & Tutorials,blog.blundellapps.co.uk,214,http://blog.blundellapps.co.uk/tut-programmatically-create-a-rippledrawable-of-any-color/
Colt McAnlis shares his obsession (addiction really) about Data Compression.,Understanding Compression,Articles & Tutorials,medium.com,214,https://medium.com/@duhroach/understanding-compression-69c874de6ad7#.jhzzf5ngh
"As one of the co-organizers of 360|AnDev, Dave Smith recently took it upon himself to build the conference Android app using Firebase. ",Firebase Drives the 360|AnDev Application,Articles & Tutorials,wiresareobsolete.com,214,http://wiresareobsolete.com/2016/07/360andev-firebase/
So far in this series Mark Allison has looked at many aspects of ContstraintLayout itself but there are a couple of features of the visual editor which are also worthy of study.,ConstraintLayout – Part 7,Articles & Tutorials,blog.stylingandroid.com,214,https://blog.stylingandroid.com/constraintlayout-part-7/
"Buddybuild is a mobile continuous integration and deployment platform that takes minutes to set-up. Our SDK makes it super easy to get feedback and crash reports from users in real-time. Stop cobbling together and maintaining disparate build, deployment, crash reporting and feedback systems. Focus on what you do best: creating apps people love!",Buddybuild: continuous integration & delivery made easy! ,Sponsored,buddybuild.com,214,https://buddybuild.com/?ref=androidweekly0717
Get the new Playbook app for developers to stay up to date with features and best practices that will help you grow a successful app or game business on Google Play.,Succeed on Google Play with help from a new app,Sponsored,play.google.com,214,https://play.google.com/store/apps/details?id=com.google.android.apps.secrets&utm_source=newsletter&utm_medium=email&utm_content=ad4&utm_campaign=androidweekly
Bored at work? Want to try a new stack? Find 3500+ great tech companies on Hired who will compete to hire you. Try it today.,Hired is the best place to find engineering jobs,Sponsored,hired.com,214,https://hired.com/?utm_source=newsletter&utm_medium=androidweekly&utm_term=cat-tech-android&utm_campaign=q2-16&utm_location=us&utm_content=bestplace
"We have fully embraced RXJava, using it for all async operations. We investigate and utilize new third party libraries, including but not limited to Butterknife/OkHTTP/Retrofit/Guava (not new but grrreat!) /Picasso/ Roboelectric/ Mockito, etc. etc.We were out with the release of Wear & Google Fit.",Principal Android Developer,Jobs,"Boston, MA",214,https://boards.greenhouse.io/runkeeper/jobs/200526
"ButterKnife v8.2.0 released with view binding support for library projects. Yes, you read that right.",butterknife,Libraries & Code,github.com,214,https://github.com/JakeWharton/butterknife/blob/master/CHANGELOG.md
"JetBrains presents the first preview version of Kotlin 1.1. It's far from Beta, but the brave and curious ones can play with new exciting things (and hopefully give some invaluable feedback).","First glimpse of Kotlin 1.1: Coroutines, Type aliases and more",News,blog.jetbrains.com,214,https://blog.jetbrains.com/kotlin/2016/07/first-glimpse-of-kotlin-1-1-coroutines-type-aliases-and-more/
"Matt Precious explains when and when not to go custom, and provide tips and tricks for getting the most out of your views. ",Don’t Fear the Canvas,Videos & Podcasts,www.youtube.com,214,https://www.youtube.com/watch?v=KH8Ldp39TUk&feature=youtu.be
"Ellen Shapiro compares iOS & Android Testing, and tells us one thing from each platform she would like to bring to the other. And yes, there are Futurama references.",iOS & Android Testing,Videos & Podcasts,www.youtube.com,214,https://www.youtube.com/watch?v=-__P_QID3Ag&feature=youtu.be
The goal of this presentation is to get you started developing great apps for Android Auto.,Android Auto: The Right Information for the Road Ahead,Videos & Podcasts,www.youtube.com,214,https://www.youtube.com/watch?v=GeSKaz6PCm4&feature=youtu.be
Direct Reply allows you to receive text input from the user directly in the notification shade.,Notifications with Direct Reply,Videos & Podcasts,www.youtube.com,214,https://www.youtube.com/watch?v=Zg4v9G-lku8&feature=youtu.be
"In this video, Google provides guidelines and best practices for enabling Google Cast for your app. They walk through live examples to demonstrate specific concepts.",UX Design for Google Cast,Videos & Podcasts,www.youtube.com,214,https://www.youtube.com/watch?v=Kch8n4tcOZQ&feature=youtu.be
Chiu-Ki Chan shares her tips and techniques for dealing with a wide range of densities and resolutions.,Supporting Multiple Android Device Definitions,Videos & Podcasts,www.youtube.com,214,https://www.youtube.com/watch?v=zImbxlqptBQ&feature=youtu.be
"Timothy Jordan, host of The Developer Show, chats with Mihai Ionescu, Developer Platform Manager about Google Search APIs.",The Developer Show (Search and App Indexing),Videos & Podcasts,www.youtube.com,214,https://www.youtube.com/watch?v=75lHEyJZsCE&feature=youtu.be
"Smart mirrors come from the idea of bringing technology into every-day, not-so-smart objects: the traditional mirrors. This article shows how to build one yourself.","Mirror, Smart Mirror on the wall…",Specials,www.novoda.com,214,https://www.novoda.com/blog/mirror-smart-mirror-on-the-wall/
"You want to visit the Droidcon NYC this year? We have a voucher for you: ""androidweekly""",Droidcon NYC,Events,droidcon.nyc,214,http://droidcon.nyc/
A good build process makes everyone’s lives easier. Running tests and static code analysis gives developers confidence and peace-of-mind. Product managers and QA benefit from automatically shared builds that clearly indicate changes.,Streamlining Android Build Process,Articles & Tutorials,medium.com,213,https://medium.com/@jordanjoz/streamlining-eeros-android-build-process-6a870ef40a89#.hlqqstmnr
Andrey Kulikov shares some ways to add meaningful animations to your app.,Transitions in Android ,Articles & Tutorials,medium.com,213,https://medium.com/@andkulikov/animate-all-the-things-transitions-in-android-914af5477d50#.jlctdpkq0
In this post Wolfram Rittmeyer highlights what he likes about the new ConstraintLayout and the new editor.,Some Thoughts on Android's new ConstraintLayout ,Articles & Tutorials,www.grokkingandroid.com,213,http://www.grokkingandroid.com/thoughts-on-constraintlayout-and-design-editor/
"OkHttp 1.0 started out as an optimized implementation of HttpURLConnection. The latest OkHttp 3.4.0-RC1, cleans up a lot of legacy implementation issues from the past releases.",The Last HttpURLConnection ,Articles & Tutorials,publicobject.com,213,https://publicobject.com/2016/07/03/the-last-httpurlconnection/
"In this second part, Rebecca Franks goes over the typical structure and setup of your Android app in order to enable testing.",Introduction to Automated Android Testing - Part 2,Articles & Tutorials,riggaroo.co.za,213,https://riggaroo.co.za/automated-android-testing-part-2-setup/
This post presents what the Philosophical Hacker found when he dug into the source code of the espresso test recorder.,An Espresso Test Recorder Deep Dive,Articles & Tutorials,www.philosophicalhacker.com,213,http://www.philosophicalhacker.com/post/an-espresso-test-recorder-deep-dive/
"People see React Native as a write-once-deploy-anywhere solution, potentially speeding up development for applications, but is React Native the best choice for your next project?",React Native: Is it the end of native development?,Articles & Tutorials,www.novoda.com,213,https://www.novoda.com/blog/is-it-the-end-of-native-development/
Udi Cohen writes about tools and techniques for optimizing lists and data loads in the Facebook app.,Memory optimization for feeds on Android,Articles & Tutorials,code.facebook.com,213,https://code.facebook.com/posts/857070764436276/memory-optimization-for-feeds-on-android/
"The “internet of things” (IoT) is simple: everyday objects that have internet connectivity and sensors that can gather, transmit and receive information. But why does this ubiquitous functionality affect you as an Android developer?",Five reasons why to develop for the internet of things,Articles & Tutorials,www.novoda.com,213,https://www.novoda.com/blog/five-reasons-why-android-developers-should-start-developing-for-the-internet-of-things/
"Maybe you think that eliminating findViewById is a great first step, but there is still too much boilerplate code. Android Data Binding makes these things much easier.",Android Data Binding: Adding some variability,Articles & Tutorials,medium.com,213,https://medium.com/google-developers/android-data-binding-adding-some-variability-1fe001b3abcc#.usmabanjv
Colt McAnlis noticed that Photoshop exports a 16x16 pixel PNG image that is way too big. So he decided to dig in a bit more to figure out what was going on.,Hidden data in your image files,Articles & Tutorials,medium.com,213,https://medium.com/@duhroach/hidden-data-in-your-image-files-a68ad61081b8#.ur5y8bqn0
"In Android Nougat, Google has changed how Android handles trusted certificate authorities (CAs) to provide safer defaults for secure app traffic.",Changes to Trusted Certificate Authorities in Android Nougat,Articles & Tutorials,android-developers.blogspot.com,213,http://android-developers.blogspot.com/2016/07/changes-to-trusted-certificate.html
"After a year, Thomas Nield did find a few cases where reactive may not necessarily be a good fit. ",When Not to Use RxJava,Articles & Tutorials,tomstechnicalblog.blogspot.com,213,http://tomstechnicalblog.blogspot.com/2016/07/when-not-to-use-rxjava.html
"In the previous parts, Mark Allison showed the underlying principles of ConstraintLayout. Now he takes a look at how to apply it in practice with mimicking the behavior of a weighted LinearLayout.",ConstraintLayout – Part 6,Articles & Tutorials,blog.stylingandroid.com,213,https://blog.stylingandroid.com/constraintlayout-part-6/
Get the new Playbook app for developers to stay up to date with features and best practices that will help you grow a successful app or game business on Google Play.,Grow your business on Google Play ,Sponsored,play.google.com,213,https://play.google.com/store/apps/details?id=com.google.android.apps.secrets&utm_source=newsletter&utm_medium=email&utm_content=ad3&utm_campaign=androidweekly
"The industry leading mobile PDF library helps you achieve seamless viewing, annotating and fast indexed searching of PDFs. Let us take care of your PDF needs so you can focus on what makes your app great. The library can be customized to any use case and integrated in minutes. Come see why were trusted by Atlassian, Box, IBM and others.",PSPDFKit - PDF SDK Trusted by Companies You Know ,Sponsored,pspdfkit.com,213,https://pspdfkit.com/
"Hired lets you sit back while job offers come to you. When you complete your profile, instantly apply to 3,500+ companies on the platform who will contact you with job offers, including salary and equity up-front. Try it today.",The Easiest Way to Find a Job,Sponsored,hired.com,213,https://hired.com/?utm_source=newsletter&utm_medium=androidweekly&utm_term=cat-tech-android&utm_campaign=q2-16&utm_location=us&utm_content=easiest
"Functional animation is subtle animation that has a clear, logical purpose. It reduces cognitive load, prevents change blindness and establish a better recall in spatial relationships. But there is one more thing. Animation brings user interface to life.",What Makes a Good Transition?,Design,uxplanet.org,213,https://uxplanet.org/functional-animation-in-ux-design-what-makes-a-good-transition-d6e7b4344e5e#.3aiqmq2at
"We’re looking for experienced Android engineers to come and help us reinvent email and calendar on mobile for millions of people. Based in SF or NY, you'd be part of the Outlook for Android team, building the best user experience out there alongside our server and design teams.",Android Engineer at Microsoft,Jobs,"United States, San Francisco CA / New York NY",213,https://aka.ms/d9nqhi
A custom animation with scroll listener to recycler views,FocusResize,Libraries & Code,github.com,213,https://github.com/borjabravo10/FocusResize
"Simple yet powerful composition library for Android. Featured helps you to split activity or fragment code into truly decoupled, testable and maintainable features.",featured,Libraries & Code,github.com,213,https://github.com/beworker/featured
The Android Tools team just released Android Studio 2.2 Preview 5 the Canary channel. This build contains a large number of bug fixes.,Android Studio 2.2 Preview 5 Available,News,tools.android.com,213,http://tools.android.com/recent/androidstudio22preview5available?pli=1
ConstraintLayout alpha4 ships with Studio 2.2 preview 5 and is packed with performance improvements.,Romain Guy on the latest ConstraintLayout alpha4 ,News,twitter.com,213,https://twitter.com/romainguy/status/751509952431206400?s=03
"Doze mode was introduced in Marshmallow and has been expanded upon in Android Nougat and now runs soon after your screen turns off, batching network access and jobs into regular maintenance windows.",An ~extended~ Doze mode,Videos & Podcasts,www.youtube.com,213,https://www.youtube.com/watch?v=HBPQZEU_ofg&feature=youtu.be
"Huyen chats with Juan Felipe Alvarez, Android developer, about Android in Medellín and how Juan Felipe co-founded the Medellín Android meetup.",Medellín Android ,Videos & Podcasts,www.youtube.com,213,https://www.youtube.com/watch?v=qzllyoCbF9w&feature=youtu.be
"In this talk Jake will cover how the so-called robot pattern allows you to create stable, readable, and maintainable tests with the aid of Kotlin’s language features.",Instrumentation Testing Robots ,Videos & Podcasts,realm.io,213,https://realm.io/news/kau-jake-wharton-testing-robots/
"Hans Dockter gave a demo of all the new features you will find in Gradle 3.0: Daemon enabled by default, composite Builds and performance Improvements",Gradle 3.0 Preview,Videos & Podcasts,www.youtube.com,213,https://www.youtube.com/watch?v=mvBoIro4go4
"In this episode we talk to Trello engineer, GDE, YouTuber, Caster IO instructor and View magician Huyen about all things custom View/ViewGroups.",Custom Views & ViewGroups with Huyen Tue Dao,Videos & Podcasts,fragmentedpodcast.com,213,http://fragmentedpodcast.com/episodes/047/
"There are some simple principles of good authentication user experience design that can make things a lot easier. Steven Soneff discusses tips for effective UI to techniques for secure, password-less authentication built on open standards and more.",Building simple and secure account systems on Android,Videos & Podcasts,www.youtube.com,213,https://www.youtube.com/watch?v=4Dbko7ebrZA&feature=youtu.be
A traditional programming approach quickly reached its performance limit when processing sensor data with a high sampling frequency. How can we avoid frequent garbage collections? How can we offload as much as possible from the UI thread?,Android Industrial: Real-time data visualization,Videos & Podcasts,www.youtube.com,213,https://www.youtube.com/watch?v=QGqzJjJAhBU&feature=youtu.be
Dave Smith examines how Google Play Services libraries are constructed.,Play Services Complexity,Articles & Tutorials,wiresareobsolete.com,212,http://wiresareobsolete.com/2016/06/play-services-complexity/
"In this series, Rebecca Franks is going to try make testing a bit easier for you. This first post is just to get you started with testing.",Introduction to Automated Android Testing - Part 1,Articles & Tutorials,riggaroo.co.za,212,https://riggaroo.co.za/introduction-automated-android-testing/
"Related to other improvements to the Android platform, the dynamic linker in Android M and N has stricter requirements for writing clean, cross-platform compatible native code in order to load. It is necessary that an application’s native code follows the rules and recommendations in order to ensure a smooth transition to recent Android releases.",Android changes for NDK developers,Articles & Tutorials,android-developers.blogspot.com,212,http://android-developers.blogspot.com/2016/06/android-changes-for-ndk-developers.html
"This article examines common sources of memory leaks on Android, and how to clean them up.","Memory leaks in Android — identify, treat and avoid",Articles & Tutorials,medium.com,212,https://medium.com/freenet-engineering/memory-leaks-in-android-identify-treat-and-avoid-d0b1233acc8#.5nh9i85wc
How did Instagram engineering scale the team and create so many awesome new features while maintaining our best-in-class app size and performance? Read the article to find out.,Instagram + Android: Four Years Later,Articles & Tutorials,engineering.instagram.com,212,https://engineering.instagram.com/instagram-android-four-years-later-927c166b0201#.xnfd0x8p2
Romain Guy experiments with a better underline for text on Android.,A better underline for Android,Articles & Tutorials,medium.com,212,https://medium.com/google-developers/a-better-underline-for-android-90ba3a2e4fb#.6olj0w1i6
