description,title,section,site,issue_num,link
"Four years ago on 28th of October 2011 we send out the very first issue of Android Weekly to 16 subscribers! Now we have more than 32000 email subscribers and about 10000 followers on our social media channels. But there is no Android Weekly without you! So we, Sebastian, Gyuri and Martin, want to thank you, the bloggers, writers, podcasters, designers and all the other great people that are creating the incredible content to share with the Android development community. Keep up the good work!  And a big thank you to every subscriber and reader of our issues and for all the good feedback that we've got over the time. You are super awesome! ",Four years of Android Weekly - Thank you!,Articles & Tutorials,androidweekly.net,177,http://androidweekly.net
Dmytro Danylyk's presentation on how designers and developers can work together on designing a new app.,Planning Android Screens ,Articles & Tutorials,slides.com,177,http://slides.com/dmytrodanylyk/planning-android-screens#/
Joe Birch recaps his experiences at Droidcon London.,Things I did at Droidcon London,Articles & Tutorials,medium.com,177,https://medium.com/@hitherejoe/things-i-did-at-droidcon-london-3fa45d093f0a#.go5ofk566
"Saúl Molinero introduces the CoordinatorLayout from the Material support library, and shows how to achieve various scrolling effects with it.",Mastering the Coordinator Layout,Articles & Tutorials,saulmm.github.io,177,http://saulmm.github.io/mastering-coordinator/
"After browsing though other blog posts about how to publish an Android Library, Etienne Lawlor still found that there were some missing details and that all the information was in different places. So he describes the entire process in this post.",Creating and Publishing an Android Library,Articles & Tutorials,medium.com,177,https://medium.com/@etiennelawlor/the-complete-guide-to-creating-an-android-library-46628b7fc879#.fpcy9pvc7
"One of the cornerstones of Material design is meaningful motion between screens. These animations are supported in the form of the transitions framework, which allows us to animate transitions between Activities and Fragments",Fragment transitions with shared elements,Articles & Tutorials,medium.com,177,https://medium.com/@bherbst/fragment-transitions-with-shared-elements-7c7d71d31cbb#.4saqhbqoc
"ReactiveX is an API that focuses on asynchronous composition and manipulation of observable streams of data or events by using a combination of the Observer pattern, Iterator pattern, and features of Functional Programming. ",Getting Started with RxJava and Android,Articles & Tutorials,www.captechconsulting.com,177,http://www.captechconsulting.com/blogs/getting-started-with-rxjava-and-android
"Dependency Injection (DI) is a design pattern which has been around for while, but recently it has become more commonly used in the development of Android applications. DI allows developers to write code that has low coupling and which can therefore be easily tested.",Dependency Injection on Android,Articles & Tutorials,tech.just-eat.com,177,http://tech.just-eat.com/2015/10/26/dependency-injection-on-android/
Donn Felker contemplates the strengths and weaknesses of the Android platform.,Will the Real Android Please Stand Up,Articles & Tutorials,realm.io,177,https://realm.io/news/will-the-real-android-please-stand-up/
"In this series, Mark Allison will explore how to integrate and animate different elements of the AppBar to provide smooth UI and UX which implement material design style animations and transitions.",AppBar – Part 1,Articles & Tutorials,blog.stylingandroid.com,177,https://blog.stylingandroid.com/appbar-part-1/
The Place Picker Widget and Autocomplete component are two powerful features part of Google Play Services. This article takes a look at both of these components and how you can implement them in your applications.,Exploring Google Play Services: Place Picker & Autocomplete,Articles & Tutorials,medium.com,177,https://medium.com/@hitherejoe/exploring-play-services-place-picker-autocomplete-150809f739fe#.9ns7yi4oq
"In these slides you will learn what RxJava is about, how to use it on Android and how RxAndroid can be used to build maintainable Android Apps from networking with Retrofit2 to UI with the new RxBinding and RxLifecycle libraries powered by MVP.",Get Reactive,Articles & Tutorials,speakerdeck.com,177,https://speakerdeck.com/passsy/get-reactive
An in-depth article about implementing more advanced video recording features in your app.,How We Built Instagram for Videos,Articles & Tutorials,yalantis.com,177,https://yalantis.com/blog/video-recording-app-development-how-we-built-instagram-for-videos/
Seven new tidbits for developers.,Android Development Tidbits - No. 3,Articles & Tutorials,willowtreeapps.com,177,http://willowtreeapps.com/blog/android-development-tidbits-no-3/?utm_source=social&utm_medium=social&utm_campaign=android-tidbits-no3_CF
"The Dropbox mobile team is focused on innovation within the Dropbox app, constantly improving both the technical foundation and the user interface. Come build the future of Dropbox!",Android Software Engineer at Dropbox,Jobs,"Seattle, WA",177,https://www.dropbox.com/jobs/listing/109128
"Plaid is a showcase of material design that we hope you will keep installed. It pulls in news & inspiration from Designer News, Dribbble & Product Hunt. It demonstrates the use of material principles to create tactile, bold, understandable UIs.",Plaid,Libraries & Code,github.com,177,https://github.com/nickbutcher/plaid
"A powerful Android chart view / graph view library, supporting line- bar- pie- radar- bubble- and candlestick charts as well as scaling, dragging and animations.",MPAndroidChart,Libraries & Code,github.com,177,https://github.com/PhilJay/MPAndroidChart
A easy way of using Android SharedPreferences,Favor,Libraries & Code,github.com,177,https://github.com/soarcn/Favor
"Earlier this year Google previewed Brillo and Weave, their complete solution for building connected devices. Now they're extending this to the broader developer community as part of our invite program.",Building Brillo-iant devices with Weave for a Connected world,News,googledevelopers.blogspot.com,177,http://googledevelopers.blogspot.com/2015/10/building-brillo-iant-devices-with-weave_27.html
"To learn how to extend your existing media and messaging apps to work within a car, Google collaborated with Udacity to introduce a new course on Ubiquitous Computing with Android Auto.",New Course on Developing Android Apps for Auto,News,android-developers.blogspot.com,177,http://android-developers.blogspot.com/2015/10/introducing-new-course-on-developing.html
Learn how to get started with Android and Android Studio in this short tutorial. It demontrates how to install Android Studio and create your first Android app,Android and Android Studio: Getting Started,Videos & Podcasts,www.youtube.com,177,https://www.youtube.com/watch?v=Z98hXV9GmzY&feature=youtu.be
"Chiu-Ki and Virginia chat about how they collaborated on Fit Cat, and how developers and designers communicate.",Android Dialogs: Virginia Poltrack,Videos & Podcasts,www.youtube.com,177,https://www.youtube.com/watch?v=4kCwhnAZjwI
"Which are the most popular cloud APIs? Does mobile, IoT or cloud development pay better? These are just some of the questions that our friends at VisionMobile tackle in their latest Developer Economics research. Take their 10-minute National Trends survey and help piece together 2015’s hottest developer trends.",Developer Economics State of the Nation report,Specials,vmob.me,177,http://vmob.me/DE1Q16AndroidWeekly
