description,title,section,site,issue_num,link
Josias Sena's simplified tutorial on how to unit test the “oh so amazing” MVP architecture pattern that many of us try to follow.,Testing MVP using Espresso and Mockito,Articles & Tutorials,josiassena.com,254,https://josiassena.com/testing-mvp-using-espresso-and-mockito/
Are you going to create a Gradle plugin in Kotlin? Check out these useful tips!,How to Create Gradle Plugin in Kotlin,Articles & Tutorials,www.thedroidsonroids.com,254,https://www.thedroidsonroids.com/blog/how-to-create-gradle-plugin-in-kotlin/
"In order to take full advantage of Kotlin, we have to revisit some best practices we got used to in Java. Many of them can be replaced with better alternatives that are provided by Kotlin.",Idiomatic Kotlin. Best Practices.,Articles & Tutorials,blog.philipphauer.de,254,https://blog.philipphauer.de/idiomatic-kotlin-best-practices/
"A friend of Brendan Fahy's recently asked him for some advice about interviewing Android developers, which he ended up writing down for everyone to read.",Interviewing Android Developers,Articles & Tutorials,medium.com,254,https://medium.com/@brendan_fahy/interviewing-android-developers-435ce69b06fa
Zarah Dominguez explains how to get into presenting at your local Droidcon or other event.,All You Need is Just a Little Patience,Articles & Tutorials,zdominguez.com,254,http://zdominguez.com/2017/04/17/all-it-takes-patience.html
"Sylvain Galand introduces Mirror, a Java library allowing you to write interfaces with annotations - à la Retrofit - to avoid the pain of the reflection API.",Mirror: Easy Reflection for Java and Android,Articles & Tutorials,medium.com,254,https://medium.com/genymobile/mirror-easy-reflection-for-java-and-android-923f54b1f165
This tutorial is all about in app navigation in React Native.,Navigation and Styling with React Native,Articles & Tutorials,developerlife.com,254,https://developerlife.com/2017/04/15/navigation-and-styling-with-react-native/
Michael Yotive looks at Fragments in 2017 and what options exist if you want to avoid them.,Fragments: The Solution to (and Cause of) All of Android’s Problems,Articles & Tutorials,news.realm.io,254,https://news.realm.io/news/michael-yotive-state-of-fragments-2017/
"Coltin Caverhill describes Yelp's CI/CD setup on a dedicated cluster of AWS machines. These machines run JUnit tests, static analysis, build APKs, merge code, and send notifications.",Continuous Integration on Android,Articles & Tutorials,engineeringblog.yelp.com,254,https://engineeringblog.yelp.com/2017/04/continuous-integration-on-android.html
Robert Simoes shares Gradle task to archive APKs once built through Android Studio.,A Groovy Script to Save Them All,Articles & Tutorials,medium.com,254,https://medium.com/@RobertSimoes/a-new-devs-guide-to-google-play-sanity-4-a-groovy-script-to-save-them-all-456a12672886
"VR has the potential to provide an entirely new perspective on people, places, and things. Shazia Makhdumi wants to encourage the developer community to push the envelope of innovation for VR, particularly in inspiring learning and creativity.",Inspiring learning and creativity with VR,Articles & Tutorials,medium.com,254,https://medium.com/googleplaydev/inspiring-learning-and-creativity-with-vr-7ef2b8fb8d59
"Stop struggling with long build times and unusable tools. JRebel For Android is now FREE! Yes, you heard us right.",Your build took how long?!,Sponsored,zeroturnaround.com,254,https://zeroturnaround.com/software/jrebel-for-android/free/?utm_source=androidweekly&utm_medium=promoted_post&utm_campaign=jrae&utm_content=free
"Kobiton is the mobile device cloud platform you need to manage the devices you own and access the devices you want. From manual to automation testing, Kobiton gives you one view of all your testing history. Sign up to start your free 15 day trial and start testing on real devices!",Kobiton: Your Complete Mobile Device Lab Solution,Sponsored,www.kobiton.com,254,https://www.kobiton.com/?utm_source=Android%20Weekly%204.23&utm_medium=Newsletter%20Sponsorship&utm_campaign=Android%20Weekly%204.23%20placement&utm_term=Mobile%20Device%20Lab&utm_content=Production
"Buddybuild is the continuous integration & deployment platform trusted by companies like Slack, Meetup, Firefox to reliably build, test & deploy their mobile apps. It saves you the time required to setup & operate a CI / CD system so you can stay focused on crafting apps users love. See why 1000s of companies love buddybuild.",Buddybuild - a CI & CD built for Android developers,Sponsored,www.buddybuild.com,254,https://www.buddybuild.com/?androidweekly0217
"We at Jack Henry are driven to break the norm of same-old banking apps. With a focus on great user experience and design, we're looking for engineers who are invested in the platform. If you're reading Android Weekly, you're probably the type of developer with the enthusiasm we want on our team!",Senior Android Software Engineer,Jobs,Remote,254,http://careers.jackhenry.com/jobs/6275321-senior-android-software-engineer-remote
Are you an awesome Android Developer?  Do you want to work on products that are seen by tens of millions of users?  Are you passionate about clean code? Tinder is hiring talented Senior Android Engineers that will be instrumental in taking our product to the next level! Apply below,Senior Android Engineer @ Tinder,Jobs,Los Angeles OR Palo Alto,254,https://www.gotinder.com/jobs?gh_jid=264208
"Facebook has released Litho at F8. Litho uses a declarative API to define UI components. You simply describe the layout for your UI based on a set of immutable inputs and the framework takes care of the rest. With code generation, Litho can perform optimisations for your UI under the hood, while keeping your code simple and easy to maintain.",Litho,Libraries & Code,fblitho.com,254,http://fblitho.com/
Ishan Khanna wrote a Chrome plugin that helps you navigate classes in your project similarly to Android Studio.,How to navigate through your java projects on Github like a boss?,Tools,medium.com,254,https://medium.com/@droidchef/how-to-navigate-through-your-java-projects-on-github-like-a-boss-488a37e16310
All the presentations from Droidcon Italy 2017,Droidcon Italy 2017,Videos & Podcasts,www.youtube.com,254,https://www.youtube.com/playlist?list=PL4ebO4PmeAi4MgpaaK9Hej0P6ooIhmfms
RxJava's use in building Android apps has grown rapidly! Combining and composing synchronous and asynchronous sources of data has become easy. That burden that remains is where to put the overall state of the application and how to handle its changes. This talk will be an exploration in how we can increase the confidence and determinism of our app state.,Managing State with RxJava by Jake Wharton,Videos & Podcasts,www.youtube.com,254,https://www.youtube.com/watch?v=0IKHxjkgop4&feature=youtu.be
"In this episode, Chet and Tor talk with Xavier Ducrohet and Jerome Dochez from the Android Studio team. We talk about gradle, gradle, and gradle. And then some more about gradle, rounding out the dicussion with a chat about gradle before ending on a brief discourse on gradle",ADB 64: Gradleweiss,Videos & Podcasts,androidbackstage.blogspot.com,254,http://androidbackstage.blogspot.com/2017/04/episode-64-gradleweiss.html
"Components for Android allows developers to implement complex, efficient RecyclerViews through a simple declarative API. In this session we’ll discuss the function and features of this powerful framework.",Litho: A Declarative Framework for Efficient UIs,Videos & Podcasts,developers.facebook.com,254,https://developers.facebook.com/videos/f8-2017/litho-a-declarative-framework-for-efficient-uis/
"In this installment of Design Snippets, Roman Nurik looks at visual design elements in a transit-planning app called Circuit, and particularly how contrast, a clear visual language, subtle motion, and use of keylines make the app feel simple and easy to use.",Design Snippets: Circuit's simple and clean visual design,Videos & Podcasts,www.youtube.com,254,https://www.youtube.com/watch?v=o03-tAPtxOk&feature=youtu.be
