description,title,section,site,issue_num,link
"Mirek Stanek takes a look at Asynchronous injection 2 with RxJava , an  alternative to Dagger 2 Producers.",Async Injection in Dagger 2 with RxJava,Articles & Tutorials,medium.com,202,https://medium.com/@froger_mcs/async-injection-in-dagger-2-with-rxjava-e7df503343c0#.xov7044tb
"It’s still possible to minimize startup time, even when you’re following modern development practices. The key is to eliminate blocking code, reflection, and heavy resource loading.",Pushing the Limits of App Startup Time,Articles & Tutorials,blog.nimbledroid.com,202,http://blog.nimbledroid.com/2016/04/20/pushing-limits-of-app-startup-time.html
Artem Zinnatullin shares three tips for making https communications in your app more secure.,Protecting https for Android/Java apps,Articles & Tutorials,artemzin.com,202,http://artemzin.com/blog/certificate-pinning-notes-for-android-java/
after a while you’ll notice that RxBindings is missing a few callbacks that you really really need. So you decide to write one yourself! Amanda Hill shows you how to do it.,"Observables, and Callbacks and Threading, Oh My!",Articles & Tutorials,robots.thoughtbot.com,202,https://robots.thoughtbot.com/observables-and-callbacks-and-threading-oh-my
Paresh Mayani shares some tips about features and functionalities beyond @Bind which Butter Knife provides and can help reduce boilerplate code as much as possible.,Get more out of Butter Knife,Articles & Tutorials,engineering.letsnurture.com,202,http://engineering.letsnurture.com/android-get-butter-knife/
"This is part 3 of the solid Principles for Android Developers series. The third letter in the solid mnemonic acronym is L, which is for the Liskov Substitution Principle (LSP).",Solid Principles for Android #3: Liskov Substitution Principle,Articles & Tutorials,realm.io,202,https://realm.io/news/donn-felker-solid-part-3/
Matthew Wear introduces the on conflict replace SQlite statement for easily updating your tables of data.,Android Lightweight Syncing To Sqlite With On Conflict Replace,Articles & Tutorials,matthewwear.xyz,202,http://matthewwear.xyz/android-lightweight-syncing-to-sqlite-with-on-conflict-replace/
"In this tutorial, Paul Trebilcox-Ruiz expands on Fit for Android with the Sessions API, which allows you to organize activity data by time intervals.",Google Fit for Android: Sessions API,Articles & Tutorials,code.tutsplus.com,202,http://code.tutsplus.com/tutorials/google-fit-for-android-sessions-api--cms-25857
Adel Nizamutdinov talks about Observable’s completion semantics and Subscriber.add(Subscription) method.,Using RxJava Observable's Completion Semantics for Greater Good,Articles & Tutorials,adelnizamutdinov.github.io,202,http://adelnizamutdinov.github.io/blog/2015/01/23/using-rxjavas-observable-semantics-for-greater-good/
This article shows how to integrate Google's Cloud Test Lab with a Continuous Integration build.,Using Google Cloud Test Lab with TeamCity,Articles & Tutorials,building.usebutton.com,202,http://building.usebutton.com/testing/cloud/android/ci/2016/04/20/teamcity-google-device-cloud/
"In the previous article Mark Allison looked at how to send configuration changes from the mobile companion app, yet the Wear app was blissfully unaware of those changes, simply because it isn’t yet listening for them. Here's how to do that.",Something O’Clock – Part 4,Articles & Tutorials,blog.stylingandroid.com,202,https://blog.stylingandroid.com/something-oclock-part-4/
Creating products for emerging markets presents unique challenges. This article shares some thoughts on what this team learned.,Creating apps for emerging markets,Articles & Tutorials,medium.com,202,https://medium.com/mutual-mobile/creating-apps-for-emerging-markets-66b8d4b3b7eb#.rteepo3bk
"In the previous part, Dávid Karnok introduced the concepts around operator fusion. In this post, he'll detail the API and protocols required make operator fusion happen",Advanced RxJava: Operator fusion (part 2),Articles & Tutorials,akarnokd.blogspot.com,202,http://akarnokd.blogspot.com/2016/04/operator-fusion-part-2-final.html
"Spend less time on routine tasks with Sympli—a design handoff and collaboration tool that works with Sketch, Photoshop, and your IDE. Sympli Android Studio plugin extends autocomplete and allows you to inspect mockups, sync assets, and set automatic asset renaming rules to implement design quicker.",Sympli: Quicker Design Handoff and Implementation,Sponsored,sympli.io,202,https://sympli.io/?utm_source=WebAd&utm_medium=banner&utm_campaign=AndroidWeekly
Bored at work? Want to try a new stack? Find 3500+ great tech companies on Hired who will compete to hire you. Try it today.,Hired is the best place to find engineering jobs,Sponsored,hired.com,202,https://hired.com/?utm_source=newsletter&utm_medium=androidweekly&utm_term=cat-tech-android&utm_campaign=q2-16&utm_location=us&utm_content=bestplace
"We are looking for a Mobile Engineer to lead the design, development and maintenance of our consumer facing Abercrombie & Fitch and Hollister Co. mobile apps (Android).","Associate IT Analyst, Andriod Developer",Jobs,"Columbus, Ohio",202,https://www.linkedin.com/jobs2/cap/view/124744652?pathWildcard=124744652&trk=job_capjs
"Centralway’s vision is to create the world’s leading mobile banking platform. We are looking for highly skilled Android Engineers, who are interested in changing the future of mobile banking with us.","Software Engineer, Android",Jobs,Zürich,202,https://www.centralway.com/en/careers/open-positions/details#oOgFZfws
"Changing the world is all in a day's work at Apple. If you love innovation, here's your chance to make a career of it. You'll work hard. But the job comes with more than a few perks. Apple has a world-class reputation for product quality and we need your help to keep those high standards in our Android Applications.",Android Applications QA Engineer - Apple,Jobs,"Cupertino, CA",202,https://ars2.equest.com/?response_id=5b136eb36cf3a0f4dab3b33c81035a11
"Changing the world is all in a day's work at Apple. If you love innovation, here's your chance to make a career of it. You'll work hard. But the job comes with more than a few perks. Imagine what you could do at Apple, where great ideas have a way of becoming great products, services, and customer experiences very quickly.",Applications SW Engineer - Android - Apple,Jobs,"Cupertino, CA",202,https://ars2.equest.com/?response_id=6c106dbdbb26bece33274d74492e4144
"Agera is a set of classes and interfaces to help write functional, asynchronous, and reactive applications for Android. From a team at Google.",Agera,Libraries & Code,github.com,202,https://github.com/google/agera
ProGuard rules for RxJava shipped as AAR,RxJavaProGuardRules,Libraries & Code,github.com,202,https://github.com/artem-zinnatullin/RxJavaProGuardRules
We all know that Java is a bit rusty - some of us moved to Kotlin but now there is another option: Swift. Swift is a new open source programming language originally design by Apple to replace Objective-C. It's a nice and modern language that is easy to learn and it has some nice features that you'll miss in Java. Now some folks figured out how to tweak it to create Android apps. There are some rumors that Google is actually considering to adopt it for Android development.,Getting Started with Swift on Android,Libraries & Code,github.com,202,https://github.com/apple/swift/blob/master/docs/Android.md
"As a way to recognize the incredible developer community and highlight some of the best apps and games, Google is kicking off their first-ever Play Awards.",The Google Play Awards coming to Google I/O,News,android-developers.blogspot.com,202,http://android-developers.blogspot.com/2016/04/the-google-play-awards-coming-to-google.html
"With Android Wear API 23, Google has enabled the new round resource identifier which helps you separate resource files such as layouts, dimens between round and square devices.",Build beautifully for Android Wear’s Round Screen,News,android-developers.blogspot.com,202,http://android-developers.blogspot.com/2016/04/build-beautifully-for-android-wear.html
Fellow Android developer Annyce Davis joins Chris Lacy for a deep dive into all things Android TV!,Android TV with Annyce Davis,Videos & Podcasts,theblerg.net,202,http://theblerg.net/podcast/24
In this mini Fragment Donn Felker touches on a highly requested topic – working remotely.,Working Remotely,Videos & Podcasts,fragmentedpodcast.com,202,http://fragmentedpodcast.com/episodes/036/
In this short video clip learn how to change the colors of your Logcat output in Android Studio.,Changing the Logcat Colors,Videos & Podcasts,www.youtube.com,202,https://www.youtube.com/watch?v=8f5I0gCzXv4&feature=youtu.be
"While in Torino for Droidcon Italy, Huyen talks to GDE Wiebe Elsinga about why UX matters.",Android Dialogs: Wiebe Elsinga,Videos & Podcasts,www.youtube.com,202,https://www.youtube.com/watch?v=ZTSJhoaxa4g&feature=youtu.be
"We’re kicking off the series of Dev Days on 12 May with a focus on mobile. Join Amazon Appstore’s Tech Evangelist Mario Viviani & fellow Android enthusiasts for a day sharing insights & info, deep discussions plus good food & a few beers to finish off. Reserve your place now","Free Amazon Appstore Dev Day - Mobile, London",Events,www.meetup.com,202,http://www.meetup.com/de-DE/amazonappdev/?src=AndroidWeekly&chapter_analytics_code=UA-76253601-1
