description,title,section,site,issue_num,link
The Novoda team shares some tips to make your APK smaller to improve the end-users' install experience.,Leaner APKs with asset minification,Articles & Tutorials,www.novoda.com,208,https://www.novoda.com/blog/leaner-apks-with-custom-asset-minification/
"There are ways that memory can be leaked logically within Java. Ultimately, this means that your Android apps are still susceptible to wasting unnecessary memory and crashing as a result of out-of-memory (OOM) errors.",Eight Ways Your Android App Can Leak Memory,Articles & Tutorials,blog.nimbledroid.com,208,http://blog.nimbledroid.com/2016/05/23/memory-leaks.html
"Daniel Molinero Reguera introduces Dart & Henson, a library that generates a navigation layer and make it easy, convenient, fast and robust to navigate among your activities and services.",Better Android Intents with Dart & Henson,Articles & Tutorials,medium.com,208,https://medium.com/groupon-eng/better-android-intents-with-dart-henson-1ca91793944b#.7c55qxt5g
"Although still in alpha phase with some issues, Tamás Agócs shows how ConstraintLayout is a really useful tool. It can speed up the UI development and can also produce more efficient layouts.",ConstraintLayout on Android - How Ready Is It?,Articles & Tutorials,leaks.wanari.com,208,http://leaks.wanari.com/2016/05/31/constraintlayout-android/
Team Android at Basecamp recently passed a fairly big milestone — over 25% of the Basecamp 3 Android app code base now runs on Kotlin! Here they share a couple things they like about it.,Some of my favorite Kotlin features,Articles & Tutorials,m.signalvnoise.com,208,https://m.signalvnoise.com/some-of-my-favorite-kotlin-features-that-we-use-a-lot-in-basecamp-5ac9d6cea95#.1j516x7j9
"In this article, Roberto Orgiu explores another way to retain a running Observable.",Crunching RxAndroid — Part 9,Articles & Tutorials,medium.com,208,https://medium.com/crunching-rxandroid/crunching-rxandroid-part-9-37cfc28e2249#.usr05oeiz
"Drag-and-drop has been part of Android since 3.0 for single windows, but now, with multi-window support, drag-and-drop can work between apps… and that is where you need to be careful.",Be Careful of Drag-and-Drop on Android N,Articles & Tutorials,commonsware.com,208,https://commonsware.com/blog/2016/06/01/be-careful-drag-drop-android-n.html
"A lot of Android apps nowadays use RxJava as a foundation of the control flow for business logic. What if you go further and apply it everywhere, including View layer?",RxUi: Talking to Android View layer in a Reactive way,Articles & Tutorials,artemzin.com,208,http://artemzin.com/blog/rxui-talking-to-android-view-layer-in-a-reactive-way/
If you are an Android developer you probably have come to a point when you wanted to change font’s for items in you layouts. András Németh shares a great technique along with a GitHub sample.,Yet another way for applying fonts,Articles & Tutorials,medium.com,208,https://medium.com/@HackDdroid/yet-another-way-for-applying-fonts-and-more-350d45accf10#.u7snoefga
"Android developers, it's time to boost your productivity! Greenhouse is a cloud-based continuous integration service that builds, tests and distributes your apps for every commit without any complicated configuration or setup. We help you build higher quality apps that are delivered to end-users faster.",Hassle-free Continuous Integration for Mobile Apps,Sponsored,greenhouseci.com,208,http://greenhouseci.com/?utm_source=androidweekly
"Hired lets you sit back while job offers come to you. When you complete your profile, instantly apply to 3,500+ companies on the platform who will contact you with job offers, including salary and equity up-front. Try it today.",The Easiest Way to Find a Job,Sponsored,hired.com,208,https://hired.com/?utm_source=newsletter&utm_medium=androidweekly&utm_term=cat-tech-android&utm_campaign=q2-16&utm_location=us&utm_content=easiest
"Enhance your app / service with a photo editor. It's fully customizable and SDKs are available for Android, iOS and HTML5.",Photo Editor SDK,Sponsored,photoeditorsdk.com,208,http://photoeditorsdk.com
"‘Errors’ happens. They happen in our apps and they happen in our life. Whatever the cause, these errors — and how they are handled — can have a huge impact on the way user experiences your app.",User Errors,Design,uxplanet.org,208,https://uxplanet.org/mobile-ux-design-user-errors-1ad1f5d664f9#.3djawg55c
The first interaction with the app plays a key role in creating overall impression (either good or bad). And when users open a new app the last thing they want to see is multiple popups in a row asking for permissions.,The Right Ways to Ask Users for Permissions,Design,uxplanet.org,208,https://uxplanet.org/mobile-ux-design-the-right-ways-to-ask-users-for-permissions-6cdd9ab25c27#.wudy6ccbk
"We are developing the next generation of marketing automation with real-time technology. Distributed and fault tolerant, our system is processes vast amounts of data. As the Android Developer you have ownership over the 360dialog SDK and build new features that add value for mobile app developers.",Senior Android Developer,Jobs,Berlin,208,http://www.360dialog.com/jobs/
"Kudoz is looking for a Senior Android Developer to build the V2 of its job hunting mobile app. Greenfield project (no legacy code) in a fun and young startup. Contract based in Paris, France, with initial contract duration of 2 months min. starting ASAP. Competitive rate.",Senior Android Freelance @ Paris (no remote),Jobs,"Paris, France",208,http://developers.getkudoz.com/join_us/#senior-android-developer-freelance-paris-france
"We at PSPDFKit care about great software. Our framework ships in many of the top-ranked apps on Google Play. Do you know your way around Android development, Java, Kotlin and are not afraid of JNI and Modern C++? Come join us in pushing the boundaries of what Android devices can do!",Senior Android Engineer - Help us build an SDK,Jobs,Remote,208,https://pspdfkit.com/jobs/#section_android
"A showcase of RxJava and Model View Presenter, plus a number of other popular libraries for android development, including AutoValue, Retrofit, Moshi, and ButterKnife. Unit tests covering any business logic and Robolectric tests verifying the ui.",Rxjava-mvp-giphy,Libraries & Code,github.com,208,https://github.com/emmaguy/rxjava-mvp-giphy
An extension for Google's AutoValue that omits @Redacted field values from toString().,Auto-value-redacted,Libraries & Code,github.com,208,https://github.com/square/auto-value-redacted
Dynamic blur of underlying Views for Android. Includes library and small example project.,BlurView,Libraries & Code,github.com,208,https://github.com/Dimezis/BlurView
Android library for boilerplate destruction that generates boilerplate code based on annotations and lets you focus on what matters. Generated code is fully traceable. Everything is generated during compile time. No reflection used! Broken down into small modules.,Blade,Libraries & Code,github.com,208,https://github.com/FrantisekGazo/Blade
Tool for create complex morphing animations using VectorDrawables (allows morphing between any pair of SVG image),Vectalign,Tools,github.com,208,https://github.com/bonnyfone/vectalign#vectalign----
In Part 2 of the Google IO special we continue asking some simple questions to the best AndroidDev today.,Google IO 2016 (Part 2),Videos & Podcasts,fragmentedpodcast.com,208,http://fragmentedpodcast.com/episodes/43/
"Chris Lacy and Koushik Dutta break down all the big announcements such as Home, Allo, Duo and Daydream. We also discussed Google's advancements in AI, the Android Wear 2.0 release, Android Instant Apps and more.",Google I/O 2016 keynote,Videos & Podcasts,theblerg.net,208,http://theblerg.net/podcast/25
Learn how to use onData() to look for data in the Adapters backing your AdapterViews to easily bring the required row on screen.,Android Testing Patterns #3: AdapterViews and Espresso,Videos & Podcasts,www.youtube.com,208,https://www.youtube.com/watch?v=zi7v47kYKrk&feature=youtu.be
